Title,description,authors,image,previewLink,publisher,publishedDate,infoLink,categories,ratingsCount,Price,review_count,avg_rating
A Connecticut Yankee in King Arthur's Court,"When Connecticut mechanic and foreman Hank Morgan is knocked unconscious, he wakes not to the familiar scenes of nineteenth-century America but to the bewildering sights and sounds of sixth-century Camelot. Although confused at first and quickly imprisoned, he soon realises that his knowledge of the future can transform his fate. Correctly predicting a solar eclipse from inside his prison cell, Morgan terrifies the people of England into releasing him and swiftly establishes himself as the most powerful magician in the land, stronger than Merlin and greatly admired by Arthur himself. But the Connecticut Yankee wishes for more than simply a place at the Round Table. Soon, he begins a far greater struggle: to bring American democratic ideals to Old England. Complex and fascinating, A Connecticut Yankee is a darkly comic consideration of the nature of human nature and society. For more than seventy years, Penguin has been the leading publisher of classic literature in the English-speaking world. With more than 1,700 titles, Penguin Classics represents a global bookshelf of the best works throughout history and across genres and disciplines. Readers trust the series to provide authoritative texts enhanced by introductions and notes by distinguished scholars and contemporary authors, as well as up-to-date translations by award-winning translators.",Mark Twain,http://books.google.com/books/content?id=xi73sbkM1-wC&printsec=frontcover&img=1&zoom=1&source=gbs_api,http://books.google.nl/books?id=xi73sbkM1-wC&dq=A+Connecticut+Yankee+in+King+Arthur%27s+Court&hl=&cd=1&source=gbs_api,Penguin,1972/2/28,http://books.google.nl/books?id=xi73sbkM1-wC&dq=A+Connecticut+Yankee+in+King+Arthur%27s+Court&hl=&source=gbs_api,Fiction,7,12.99,4,4
Alfred Hitchcock Presents 12 Stories For Late Night,No description available,Alfred Hitchcock,,http://books.google.nl/books?id=foJizgEACAAJ&dq=Alfred+Hitchcock+Presents+12+Stories+For+Late+Night&hl=&cd=1&source=gbs_api,Unknown publisher,1982,http://books.google.nl/books?id=foJizgEACAAJ&dq=Alfred+Hitchcock+Presents+12+Stories+For+Late+Night&hl=&source=gbs_api,Detective and mystery stories,0,27.99,25,2.92
"Little women; or, Meg, Jo, Beth, and Amy,","2018 marks the 150th anniversary of the classic Little Women by Louisa May Alcott. Join Meg, Jo, Beth, and Amy as they are reenvisioned as a blended family living in modern day NYC in this beautiful, full-color graphic novel. With their father away in the military and their mother working overtime to support the family, the March sisters have to rely on one another to make it from day to day. Whether they're arguing over the bathroom, struggling with homework, fighting off bullies, understanding their crushes, or battling leukemia, there's one thing the four sisters keep questioning--will everything turn out okay? Follow modern young women, Meg, Jo, Beth, and Amy as they discover themselves and follow their dreams. This lushly-illustrated story is a must-read for fans of Raina Telgemeier's Smile and Sisters, Mariko Tamaki's This One Summer, Svetlana Chmakova's Awkward, and Victoria Jamieson's Roller Girl.",Rey Terciero,http://books.google.com/books/content?id=mymGtAEACAAJ&printsec=frontcover&img=1&zoom=1&source=gbs_api,"http://books.google.nl/books?id=mymGtAEACAAJ&dq=Little+women%3B+or,+Meg,+Jo,+Beth,+and+Amy,&hl=&cd=1&source=gbs_api","Little, Brown Books for Young Readers",2019/2/5,"http://books.google.nl/books?id=mymGtAEACAAJ&dq=Little+women%3B+or,+Meg,+Jo,+Beth,+and+Amy,&hl=&source=gbs_api",Juvenile Fiction,3,11.54,20,4.1
Jane Eyre (Everyman's Classics),"Jane Eyre (1847) has enjoyed huge popularity since first publication, and its success owes much to its exceptional emotional power. Jane Eyre, a penniless orphan, is engaged as governess at Thornfield Hall by the mysterious Mr Rochester. Her integrity and independence are tested to the limit as their love for each other grows, and the secrets of Mr Rochester's past are revealed.",Charlotte Bront√´,http://books.google.com/books/content?id=MsRAAQAAIAAJ&printsec=frontcover&img=1&zoom=1&source=gbs_api,http://books.google.nl/books?id=MsRAAQAAIAAJ&q=Jane+Eyre+(Everyman%27s+Classics)&dq=Jane+Eyre+(Everyman%27s+Classics)&hl=&cd=1&source=gbs_api,Everyman's Library,1991,http://books.google.nl/books?id=MsRAAQAAIAAJ&dq=Jane+Eyre+(Everyman%27s+Classics)&hl=&source=gbs_api,Bildungsromans,0,15.99,12,3.25
The Giver,"Given his lifetime assignment at the Ceremony of Twelve, Jonas becomes the receiver of memories shared by only one other in his community and discovers the terrible truth about the society in which he lives.",Lois Lowry,http://books.google.com/books/content?id=Io57oAEACAAJ&printsec=frontcover&img=1&zoom=1&source=gbs_api,http://books.google.nl/books?id=Io57oAEACAAJ&dq=The+Giver&hl=&cd=1&source=gbs_api,Harcourt Brace,2014/7/1,http://books.google.nl/books?id=Io57oAEACAAJ&dq=The+Giver&hl=&source=gbs_api,Juvenile Fiction,721,22.99,13,2.77
The Old Man and the Sea,No description available,Ernest Hemingway,http://books.google.com/books/content?id=K1cIZmFe7KoC&printsec=frontcover&img=1&zoom=1&edge=curl&source=gbs_api,http://books.google.nl/books?id=K1cIZmFe7KoC&printsec=frontcover&dq=The+Old+Man+and+the+Sea&hl=&cd=1&source=gbs_api,Hueber Verlag,1975,http://books.google.nl/books?id=K1cIZmFe7KoC&dq=The+Old+Man+and+the+Sea&hl=&source=gbs_api,Uncategorized,93,23.99,13,3.77
Frankenstein,"Muis Robert Walton is ontdekkingsreiziger en hoort op de Noordpool het verhaal van natuurkundige Victor Frankenstein. Tijdens een van zijn experimenten riep hij een monster tot leven: Frankenstein. Voorlezen vanaf ca. 7 jaar, zelf lezen vanaf ca. 9 jaar.",Geronimo Stilton,,http://books.google.nl/books?id=q0rzoAEACAAJ&dq=Frankenstein&hl=&cd=1&source=gbs_api,Unknown publisher,2014/12/17,http://books.google.nl/books?id=q0rzoAEACAAJ&dq=Frankenstein&hl=&source=gbs_api,Uncategorized,0,11.48,12,3.83
Atlantis Found,"Clive Cussler sends his great hero on an explosive mission in Atlantis Found, the fifteenth Dirk Pitt adventure. Around the world ancient artefacts are suddenly appearing, hinting at a catastrophe that will soon visit Earth ... Dirk Pitt is on hand at a Colorado archaeological site where an ancient and mysterious artefact has been found - one that is perhaps linked to other strange objects turning up across the globe. And soon Pitt's skills and ingenuity are desperately needed to rescue the team after a suspicious explosion seals them deep underground. It quickly becomes clear that the artefacts carry a message: warning of global Armageddon. Yet a shadowy organisation called the Fourth Empire not only wants to stop others from heeding that warning, but is also actively seeking to accelerate the end it foretells. Now Pitt and NUMA must face this diabolical foe, who will stop at nothing to wipe out all life on earth ... Packed with blistering action and hair-raising suspense, Atlantis Found is Clive Cussler at his brilliant best. Atlantis Found is the fifteenth of Clive Cussler's bestselling Dirk Pitt thrillers - the series that also includes Arctic Drift and, his first novel, Mayday - in which the discovery of an artefact could mean the end of the world. Praise for Clive Cussler: 'Cussler is hard to beat' Daily Mail 'The guy I read' Tom Clancy",Clive Cussler,http://books.google.com/books/content?id=7ZKbuTWnTy8C&printsec=frontcover&img=1&zoom=1&edge=curl&source=gbs_api,http://books.google.nl/books?id=7ZKbuTWnTy8C&printsec=frontcover&dq=Atlantis+Found&hl=&cd=1&source=gbs_api,Penguin UK,2012/6/7,https://play.google.com/store/books/details?id=7ZKbuTWnTy8C&source=gbs_api,Fiction,23,20.03,13,3.31
The Andromeda Strain,"From the author of Jurassic Park, Timeline, and Sphere comes a captivating thriller about a deadly extraterrestrial microorganism, which threatens to annihilate human life. Five prominent biophysicists have warned the United States government that sterilization procedures for returning space probes may be inadequate to guarantee uncontaminated re-entry to the atmosphere. Two years later, a probe satellite falls to the earth and lands in a desolate region of northeastern Arizona. Nearby, in the town of Piedmont, bodies lie heaped and flung across the ground, faces locked in frozen surprise. What could cause such shock and fear? The terror has begun, and there is no telling where it will end.",Michael Crichton,http://books.google.com/books/content?id=kbZxbyksU84C&printsec=frontcover&img=1&zoom=1&edge=curl&source=gbs_api,http://books.google.nl/books?id=kbZxbyksU84C&printsec=frontcover&dq=The+Andromeda+Strain&hl=&cd=1&source=gbs_api,Vintage,2012/5/14,https://play.google.com/store/books/details?id=kbZxbyksU84C&source=gbs_api,Fiction,84,18.08,13,3.46
A confederacy of dunces,"One of the BBC's '100 Novels That Shaped Our World' 'My favourite book of all time... it stays with you long after you have read it - for your whole life, in fact' Billy Connolly A monument to sloth, rant and contempt, a behemoth of fat, flatulence and furious suspicion of anything modern - this is Ignatius J. Reilly of New Orleans, noble crusader against a world of dunces. The ordinary folk of New Orleans seem to think he is unhinged. Ignatius ignores them, heaving his vast bulk through the city's fleshpots in a noble crusade against vice, modernity and ignorance. But his momma has a nasty surprise in store for him: Ignatius must get a job. Undaunted, he uses his new-found employment to further his mission - and now he has a pirate costume and a hot-dog cart to do it with... Never published during his lifetime, John Kennedy Toole's hilarious satire, A Confederacy of Dunces is a Don Quixote for the modern age, and this Penguin Modern Classics edition includes a foreword by Walker Percy. 'A pungent work of slapstick, satire and intellectual incongruities ... it is nothing less than a grand comic fugue' The New York Times",John Kennedy Toole,http://books.google.com/books/content?id=1pCbDwAAQBAJ&printsec=frontcover&img=1&zoom=1&edge=curl&source=gbs_api,http://books.google.nl/books?id=1pCbDwAAQBAJ&printsec=frontcover&dq=A+confederacy+of+dunces&hl=&cd=1&source=gbs_api,Penguin UK,2019/6/13,https://play.google.com/store/books/details?id=1pCbDwAAQBAJ&source=gbs_api,Fiction,48,11.51,25,2.72
A Farewell to Arms,"The best American novel to emerge from World War I, A Farewell to Arms is the unforgettable story of an American ambulance driver on the Italian front and his passion for a beautiful English nurse. Hemingway's frank portrayal of the love between Lieutenant Henry and Catherine Barkley, caught in the inexorable sweep of war, glows with an intensity unrivaled in modern literature, while his description of the German attack on Caporetto -- of lines of fired men marching in the rain, hungry, weary, and demoralized -- is one of the greatest moments in literary history. A story of love and pain, of loyalty and desertion, A Farewell to Arms, written when he was 30 years old, represents a new romanticism for Hemingway.",Ernest Hemingway,http://books.google.com/books/content?id=2_XH0Z81_ZEC&printsec=frontcover&img=1&zoom=1&edge=curl&source=gbs_api,http://books.google.nl/books?id=2_XH0Z81_ZEC&printsec=frontcover&dq=A+Farewell+to+Arms&hl=&cd=1&source=gbs_api,Simon and Schuster,1997/4/1,https://play.google.com/store/books/details?id=2_XH0Z81_ZEC&source=gbs_api,Fiction,11,22.99,9,3.33
A Clockwork Orange,"In de nabije toekomst maken jongeren de straten onveilig. Een van de bendeleiders wordt opgepakt maar maakt ook in detentie amok. De overheid besluit tot een wetenschappelijk experiment: geweld moet hem wezensvreemd worden. Maar niet alles verloopt volgens plan. Dit legendarische boek gaat over de vrije wil, puberteit en genetische dispositie voor misdaad en geweld. Maar ook over wanhoop, sadisme en fascisme. En wraak. Veel grotere thema's zijn er niet. Met zijn nadsat, een sociolect dat de hoofdpersonen onderling spreken, schiep Burgess bovendien een straattaal van teenagers gone bad. Ultrageweld is van alle tijden. Lees en huiver. Vijftig jaar na publicatie van het origineel verschijnt eindelijk de Nederlandse vertaling die de roman verdient. Hun grote staat van dienst, hun virtuositeit, hun taalgevoel en hun inventiviteit maken Harm Damsma en Niek Miedema tot de ideale vertalers van A Clockwork Orange.",Anthony Burgess,http://books.google.com/books/content?id=FaVzAAAAQBAJ&printsec=frontcover&img=1&zoom=1&edge=curl&source=gbs_api,http://books.google.nl/books?id=FaVzAAAAQBAJ&printsec=frontcover&dq=A+Clockwork+Orange&hl=&cd=1&source=gbs_api,Athenaeum-Polak & Van Gennep,2012/6/5,http://books.google.nl/books?id=FaVzAAAAQBAJ&dq=A+Clockwork+Orange&hl=&source=gbs_api,Juvenile Fiction,0,23.99,13,3.85
THE BOOK OF MORMON: Another Testament of Jesus Christ,"An authorized, gift edition of the sacred Mormon Scripture, first published in 1830, includes the complete text of this gospel of The Church of Jesus Christ of Latter-day Saints. 20,000 first printing.","Joseph Smith, Jr.",http://books.google.com/books/content?id=hrSAuQAACAAJ&printsec=frontcover&img=1&zoom=1&source=gbs_api,http://books.google.nl/books?id=hrSAuQAACAAJ&dq=THE+BOOK+OF+MORMON:+Another+Testament+of+Jesus+Christ&hl=&cd=1&source=gbs_api,Doubleday,Oct-06,http://books.google.nl/books?id=hrSAuQAACAAJ&dq=THE+BOOK+OF+MORMON:+Another+Testament+of+Jesus+Christ&hl=&source=gbs_api,Religion,29,15.99,25,1.96
The Fountainhead,"Her first major literary success, Ayn Rand's The Fountainhead is an exalted view of her Objectivist philosophy, portraying a visionary artist struggling against the dull, conformist dogma of his peers; a book of ambition, power, gold and love, published in Penguin Modern Classics. Architect Howard Roark is as unyielding as the granite he blasts to build with. Defying the conventions of the world around him, he embraces a battle over two decades against a double-dealing crew of rivals who will stop at nothing to bring him down. These include, perhaps most troublesome of all, the ambitious Dominique Francon, who may just prove to be Roarke's equal. This epic story of money, power and a man's struggle to succeed on his own terms is a paean to individualism and humanity's creative potential. First published in 1943, The Fountainhead introduced millions to Rand's philosophy of Objectivism: an uncompromising defence of self-interest as the engine of progress, and a jubilant celebration of man's creative potential. Ayn Rand (1905-1982), born Alisa Rosenbaum in St. Petersburg, Russia, emigrated to America with her family in January 1926, never to return to her native land. Her novel The Fountainhead was published in 1943 and eventually became a bestseller. Still occasionally working as a screenwriter, Rand moved to New York City in 1951 and published Atlas Shrugged in 1957. Her novels espoused what came to be called Objectivism, a philosophy that champions capitalism and the pre-eminence of the individual. If you enjoued The Fountainhead, you might like Rand's Atlas Shrugged, also available in Penguin Modern Classics. 'In The Fountainhead power, greed, life's grandeur flow hot and red in thrilling descriptions'London Review of Books 'Ayn Rand is a writer of great power... she writes brilliantly, beautifully, bitterly' The New York Times",Ayn Rand,http://books.google.com/books/content?id=qArDQgAACAAJ&printsec=frontcover&img=1&zoom=1&source=gbs_api,http://books.google.nl/books?id=qArDQgAACAAJ&dq=The+Fountainhead&hl=&cd=1&source=gbs_api,Penguin Modern Classics,2007,http://books.google.nl/books?id=qArDQgAACAAJ&dq=The+Fountainhead&hl=&source=gbs_api,Architects,0,11.39,13,2.54
The Devil Wears Prada,"#1 NEW YORK TIMES BESTSELLER ‚Ä?SOON TO BE A BROADWAY MUSICAL ‚Ä?The iconic novel that inspired the hit movie starring Meryl Streep and Anne Hathaway‚Äîa gloriously wicked story about the ultimate Boss from Hell and the deals we make with the devil to get to the top ‚ÄúThe degree to which The Devil Wears Prada has penetrated pop culture needs no explanation.‚Äù‚ÄîVanity Fair Andrea Sachs, a small-town girl fresh out of college, lands the job ‚Äúa million girls would die for.‚Ä?Hired as the assistant to Miranda Priestly, the high-profile, fabulously successful editor of Runway magazine, Andrea finds herself in an office that shouts Prada! Armani! Versace! at every turn, a world populated by impossibly thin, heart-wrenchingly stylish women and beautiful men clad in fine-ribbed turtlenecks and tight leather pants that show off their lifelong dedication to the gym. With breathtaking ease, Miranda can turn each and every one of these hip sophisticates into a scared, whimpering child. Andrea is sorely tested each and every day‚Äîand often late into the night‚Äîwith orders barked over the phone. She puts up with it all by keeping her eyes on the prize: a recommendation from Miranda that will get her a top job at any magazine of her choosing. As things escalate from the merely unacceptable to the downright outrageous, Andrea begins to realize that the job a million girls would die for may just kill her. And even if she survives, she has to decide whether or not it‚Äôs worth the price of her soul.",Lauren Weisberger,http://books.google.com/books/content?id=ppqvXkmGKj0C&printsec=frontcover&img=1&zoom=1&edge=curl&source=gbs_api,http://books.google.nl/books?id=ppqvXkmGKj0C&printsec=frontcover&dq=The+Devil+Wears+Prada&hl=&cd=1&source=gbs_api,Random House,2003/4/15,https://play.google.com/store/books/details?id=ppqvXkmGKj0C&source=gbs_api,Fiction,3270,11.99,25,1.96
The Picture of Dorian Gray,The Picture of Dorian Gray by Oscar Wilde,√ìscar Wilde,http://books.google.com/books/content?id=s3xejwEACAAJ&printsec=frontcover&img=1&zoom=1&source=gbs_api,http://books.google.nl/books?id=s3xejwEACAAJ&dq=The+Picture+of+Dorian+Gray&hl=&cd=1&source=gbs_api,Unknown publisher,2016/1/24,http://books.google.nl/books?id=s3xejwEACAAJ&dq=The+Picture+of+Dorian+Gray&hl=&source=gbs_api,Uncategorized,2508,20.29,3,5
Rainbow Six,"Neutralize All Enemies! ¬∑Thorough walkthroughs for all missions including Waypoints and Go Codes ¬∑Essential briefings and objectives lists ¬∑Close Quarter Battle tactics for multiplayer missions ¬∑Maps showing the location of all terrorists and objectives ¬∑Basic Training to get you and your squad ready for action ¬∑Stats for each weapon, including ammo caliber and count, rates of fire, available attachments, and special notes ¬∑Dossiers on each RAINBOW Operative ¬∑Tips on how to plan a successful mission",Michael Knight,http://books.google.com/books/content?id=_Kq7_lIdV5QC&printsec=frontcover&img=1&zoom=1&source=gbs_api,http://books.google.nl/books?id=_Kq7_lIdV5QC&q=Rainbow+Six&dq=Rainbow+Six&hl=&cd=1&source=gbs_api,Unknown publisher,2003,http://books.google.nl/books?id=_Kq7_lIdV5QC&dq=Rainbow+Six&hl=&source=gbs_api,Games & Activities,0,19.99,25,2.44
The Bear and the Dragon,"Don't Miss the Original Series Tom Clancy's Jack Ryan Starring John Krasinski! President Jack Ryan faces a world crisis unlike any he has ever known in Tom Clancy's extraordinary #1 New York Times bestseller. A high-level assassination attempt in Russia has the newly elected Ryan sending his most trusted eyes and ears‚Äîincluding antiterrorism specialist John Clark‚Äîto Moscow, for he fears the worst is yet to come. And he‚Äôs right. The attempt has left the already unstable Russia vulnerable to ambitious forces in China eager to fulfill their destiny‚Äîand change the face of the world as we know it...",Tom Clancy,http://books.google.com/books/content?id=B0oJPv_XEjIC&printsec=frontcover&img=1&zoom=1&edge=curl&source=gbs_api,http://books.google.nl/books?id=B0oJPv_XEjIC&printsec=frontcover&dq=The+Bear+and+the+Dragon&hl=&cd=1&source=gbs_api,Penguin,2001/8/1,https://play.google.com/store/books/details?id=B0oJPv_XEjIC&source=gbs_api,Fiction,30,25.99,13,3.08
Contact,"Dit boek gaat over het gebruik van nieuwe media - internet, games en mobiele telefonie - bij kinderen in de basisschoolleeftijd. Bij kinderen draaien nieuwe media in eerste instantie om contact. Ze spelen samen met vrienden games, op spelcomputers, op spelletjeswebsites en in virtuele werelden als Stardoll.nl en Habbo. Ze bekijken filmpjes op YouTube en soms maken ze die zelf om ze vervolgens met anderen te delen. Ze hebben contact met elkaar via de mobiele telefoon en MSN. Ze 'krabbelen' elkaar op Hyves en presenteren zichzelf daar aan elkaar. Vriendschap, liefde, ruzie en pesten; alles uit het echte leven heeft ook een plaats in hun digitale leefwereld. Op steeds jongere leeftijd zijn kinderen actief met nieuwe media. Sommige ouders en leerkrachten worstelen met het mediagebruik van (jonge) kinderen. Ze vragen zich af hoe de nieuwe mogelijkheden het best benut kunnen worden en hoe gevaren vermeden kunnen worden. Wat moeten kinderen leren om veilig en effici√´nt met nieuwe media om te gaan? Welke vaardigheden zijn er nodig om mediawijze burgers van hen te maken? En wat zijn hierbij taken van opvoeders? Het boek Contact! Kinderen en nieuwe media brengt het werk van de beste onderzoekers in Nederland op dit terrein samen. De auteurs genieten internationaal een uitstekende reputatie en het boek mag nu al een standaardwerk genoemd worden. Het is bij uitstek geschikt om ouders, onderwijzers en hulpverleners wegwijs te maken in de digitale leefwereld van kinderen. Het boek is een initiatief van het Sociaal Cultureel Planbureau (SCP), Stichting Mijn Kind Online en het programma Digivaardig & Digibewust.",R. Pijpers,http://books.google.com/books/content?id=0NHdBgAAQBAJ&printsec=frontcover&img=1&zoom=1&edge=curl&source=gbs_api,http://books.google.nl/books?id=0NHdBgAAQBAJ&printsec=frontcover&dq=Contact&hl=&cd=1&source=gbs_api,Bohn Stafleu van Loghum,2010/10/7,https://play.google.com/store/books/details?id=0NHdBgAAQBAJ&source=gbs_api,Psychology,0,11.99,13,3.77
The Notebook,"This step-by-step, highly visual text provides you with a comprehensive introduction to managing and maintaining computer hardware. Written by best-selling author and educator Jean Andrews, A+ GUIDE TO HARDWARE, Sixth Edition closely integrates the CompTIA A+ Exam objectives to prepare you for the hardware portions of the 220-801 and 220-802 certification exams. The new Sixth Edition also features extensive updates to reflect current technology, techniques, and industry standards in the dynamic, fast-paced field of PC repair. Each chapter covers both core concepts and advanced topics, organizing material to facilitate practical application and encourage you to learn by doing. Supported by a wide range of supplemental resources to enhance learning‚Äîincluding innovative tools, interactive exercises and activities, and online study guides‚Äîthis proven text offers an ideal way to prepare you for success as a professional PC repair technician. Important Notice: Media content referenced within the product description or the product text may not be available in the ebook version.",Jean Andrews,http://books.google.com/books/content?id=bUILAAAAQBAJ&printsec=frontcover&img=1&zoom=1&edge=curl&source=gbs_api,http://books.google.nl/books?id=bUILAAAAQBAJ&pg=PA523&dq=The+Notebook&hl=&cd=1&source=gbs_api,Cengage Learning,2013/1/9,http://books.google.nl/books?id=bUILAAAAQBAJ&dq=The+Notebook&hl=&source=gbs_api,Computers,0,10.99,25,1.88
Blood of the Fold (Sword of Truth Series),"In a fantasy world as rich and real as our own, Richard Rahl and Kahlan Amnell stand against the ancient forces which besiege the New World, forces so terrible that when last they threatened, they could only be withstood by sealing off the Old World from whence they came. Now the barrier has been breached, and the New World is again beset by their evil power",Terry Goodkind,http://books.google.com/books/content?id=3kpSPwAACAAJ&printsec=frontcover&img=1&zoom=1&source=gbs_api,http://books.google.nl/books?id=3kpSPwAACAAJ&dq=Blood+of+the+Fold+(Sword+of+Truth+Series)&hl=&cd=1&source=gbs_api,Orion Books Limited,2008,http://books.google.nl/books?id=3kpSPwAACAAJ&dq=Blood+of+the+Fold+(Sword+of+Truth+Series)&hl=&source=gbs_api,Good and evil,1,17.99,13,3.54
"Uglies (Uglies Trilogy, Book 1)",A fresh repackaging of the bestselling Uglies boks...the series that started the whole dystopian trend!,Scott Westerfeld,http://books.google.com/books/content?id=6hrbAgAAQBAJ&printsec=frontcover&img=1&zoom=1&edge=curl&source=gbs_api,"http://books.google.nl/books?id=6hrbAgAAQBAJ&printsec=frontcover&dq=Uglies+(Uglies+Trilogy,+Book+1)&hl=&cd=1&source=gbs_api",Simon and Schuster,2011/5/3,"http://books.google.nl/books?id=6hrbAgAAQBAJ&dq=Uglies+(Uglies+Trilogy,+Book+1)&hl=&source=gbs_api",Juvenile Fiction,409,17.99,25,2.76
Paradise,Geannoteerde heruitgave naar de eerste druk van de invloedrijke bundel van de Nederlandse dichter (1899-1940).,Hendrik Marsman,http://books.google.com/books/content?id=cOzZRHt5SmwC&printsec=frontcover&img=1&zoom=1&edge=curl&source=gbs_api,http://books.google.nl/books?id=cOzZRHt5SmwC&pg=PA1&dq=Paradise&hl=&cd=1&source=gbs_api,Amsterdam University Press,1997,https://play.google.com/store/books/details?id=cOzZRHt5SmwC&source=gbs_api,Uncategorized,0,18.99,25,3.72
Ulysses.,"Beschrijving van achttien episoden van √©√©n dag uit het leven van een Joodse advertentiecolporteur in Dublin in het jaar 1904, waarbij schr. zich spiegelt aan de ""Odyssee"" van Homerus.",James Augustine Aloysius Joyce,,http://books.google.nl/books?id=7hAaQgAACAAJ&dq=Ulysses.&hl=&cd=1&source=gbs_api,Unknown publisher,1984,http://books.google.nl/books?id=7hAaQgAACAAJ&dq=Ulysses.&hl=&source=gbs_api,Uncategorized,0,23.99,8,3.88
