Title,description,authors,image,previewLink,publisher,publishedDate,infoLink,categories,ratingsCount,Price,review_count,avg_rating
Watership Down,"Watership Down by Richard Adams is a true classic. This stirring tale of courage and survival against the odds has become one of the best-loved animal adventures of all time. 'We've got to go away before it's too late.' Fiver was only a small rabbit, but he had a sixth sense and foresaw that disaster was about to destroy the warren. Few believed him. Led by his brother Hazel, a small band of rabbits set out on a perilous journey to find a safe home. Fiver's intuition finally leads them to Watership Down. But here they encounter the greatest threat of all. ***Winner of the Carnegie Medal and the Guardian Children's Fiction Prize*** 'A gripping story of rebellion in a rabbit warren and the subsequent adventures of the rebels. Adams has a poetic eye and a gift for storytelling which will speak to readers of all ages for many years to come' Sunday Times 'A masterpiece. The best story about wild animals since The Wind in the Willows. Very funny, exciting, often moving' Evening Standard 'A great book. A whole world is created, perfectly real in itself, yet constituting a deep incidental comment on human affairs' Guardian Richard Adams grew up in Berkshire, the son of a country doctor. After an education at Oxford, he spent six years in the army and then went into the Civil Service. He originally began telling the story of Watership Down to his two daughters and they insisted he publish it as a book. It quickly became a huge success with both children and adults, and won the Guardian Children's Fiction Award and the Carnegie Medal in 1972. Richard Adams has written many novels and short stories, including Shardik and The Plague Dogs.",Richard Adams,http://books.google.com/books/content?id=mgQU1iZhuiEC&printsec=frontcover&img=1&zoom=1&source=gbs_api,http://books.google.com/books?id=mgQU1iZhuiEC&dq=Watership+Down&hl=&cd=1&source=gbs_api,Penguin UK,2000/8/31,http://books.google.com/books?id=mgQU1iZhuiEC&dq=Watership+Down&hl=&source=gbs_api,Fiction,2,29.99,25,4.48
The Adventures of Huckleberry Finn (Courage Literary Classics),"Not that Hemingway was correct, but he did write in 1935: ""All modern American literature comes from one book by Mark Twain called Huckleberry Finn;‚Ä?unless we are to interpret the adjective 'modern' as 'unadorned.' But Hemingway's remark somehow points to the importance of Mark Twain's breezy, fresh, and straight-forward style.Huckleberry Finn is a poor child whose only family is ‚ÄúPap‚Ä?‚Äîhis abusive drunk father. Huck runs away, and meets Jim, a slave, who is also running away. So, here we have from the very beginning of the novel, two heavy topics: child abuse and slavery. Although Mark Twain has been criticized for his stereotypical presentation Jim, he ‚Äîa white author‚Ä?imbues Jim with much humanity in an era in which slaves were considered sub-human. Had any other writer dare do such a thing? Dis anyone else besides Jane Austen write about the slave trade? It took courage to deal with such themes. But Mark Twain also threw other ethical dilemmas into the fray: It is right to obey wrong laws? Should the individual suffer to preserve society?Hence the universal importance of the book.To do honor to the original version, my editorial corrections are minimal. The language ‚Äîincluding the dialects‚Ä?have been left untouched, as well as terms today deemed offensive.",Mark Twain,http://books.google.com/books/content?id=xU7QoQEACAAJ&printsec=frontcover&img=1&zoom=1&source=gbs_api,http://books.google.com/books?id=xU7QoQEACAAJ&dq=The+Adventures+of+Huckleberry+Finn+(Courage+Literary+Classics)&hl=&cd=1&source=gbs_api,Createspace Independent Pub,2014/9/27,http://books.google.com/books?id=xU7QoQEACAAJ&dq=The+Adventures+of+Huckleberry+Finn+(Courage+Literary+Classics)&hl=&source=gbs_api,Fiction,3415,19.12,0,0
The Adventures of Tom Sawyer (Courage Literary Classics),"A mischievous youth encounters a runaway slave and together they travel down the Mississippi in search of adventure, in the classic novel accompanied by essays by Van Wyck Brooks and Carl Van Doren",Mark Twain,http://books.google.com/books/content?id=ZeynPwAACAAJ&printsec=frontcover&img=1&zoom=1&source=gbs_api,http://books.google.com/books?id=ZeynPwAACAAJ&dq=The+Adventures+of+Tom+Sawyer+(Courage+Literary+Classics)&hl=&cd=1&source=gbs_api,Courage Books,Jan-99,http://books.google.com/books?id=ZeynPwAACAAJ&dq=The+Adventures+of+Tom+Sawyer+(Courage+Literary+Classics)&hl=&source=gbs_api,Literary Criticism,3413,23.99,25,3.8
The Rise and Fall of the Third Reich,"National Book Award Winner: The definitive account of Nazi Germany and ‚Äúone of the most important works of history of our time‚Ä?(The New York Times). When the Third Reich fell, it fell swiftly. The Nazis had little time to destroy their memos, their letters, or their diaries. William L. Shirer‚Äôs sweeping account of the Third Reich uses these unique sources, combined with his experience living in Germany as an international correspondent throughout the war. The Rise and Fall of the Third Reich earned Shirer a National Book Award and continues to be recognized as one of the most important and authoritative books about the Third Reich and Nazi Germany ever written. The diaries of propaganda minister Joseph Goebbels, as well as evidence and other testimony gained at the Nuremberg Trials, could not have found more artful hands. Shirer gives a clear, detailed, and well-documented account of how it was that Adolf Hitler almost succeeded in conquering the world. With millions of copies in print, The Rise and Fall of the Third Reich is a chilling and illuminating portrait of mankind‚Äôs darkest hours. ‚ÄúA monumental work.‚Ä?‚ÄîTheodore H. White",William L. Shirer,http://books.google.com/books/content?id=fpFbuCKOLKwC&printsec=frontcover&img=1&zoom=1&edge=curl&source=gbs_api,http://books.google.com/books?id=fpFbuCKOLKwC&printsec=frontcover&dq=The+Rise+and+Fall+of+the+Third+Reich&hl=&cd=1&source=gbs_api,RosettaBooks,2011/10/23,https://play.google.com/store/books/details?id=fpFbuCKOLKwC&source=gbs_api,History,4,16.84,13,3.46
The Little Prince,No description available,Antoine de Saint-Exup√©ry,http://books.google.com/books/content?id=6948DwAAQBAJ&printsec=frontcover&img=1&zoom=1&edge=curl&source=gbs_api,http://books.google.com/books?id=6948DwAAQBAJ&pg=PP1&dq=The+Little+Prince&hl=&cd=1&source=gbs_api,Samaira Book Publishers,2017/11/4,https://play.google.com/store/books/details?id=6948DwAAQBAJ&source=gbs_api,Juvenile Fiction,2,10.66,25,2.88
"The time machine,: An invention,","The Time Machine is one of the most enduring works of the English language. A hundred years after it was first published, the book continues to be studied. The 1895 London first edition is used as a basis for the exhaustive annotations and other critical apparatus of the world's foremost Wellsian scholar. The widely reprinted version of 1924 is also fully accounted for. For most students, one of the chief points of interest is what the novel signified to readers when it was first published and how it relates to Wells's later works. Accordingly, the annotations focus on these questions. The introduction gives in great depth the background of the work and its complex bibliographical history, and a synopsis of the literary conventions that Wells used.",H. G. Wells,http://books.google.com/books/content?id=btrKygAACAAJ&printsec=frontcover&img=1&zoom=1&source=gbs_api,"http://books.google.com/books?id=btrKygAACAAJ&dq=The+time+machine,:+An+invention,&hl=&cd=1&source=gbs_api",McFarland Publishing,Apr-12,"http://books.google.com/books?id=btrKygAACAAJ&dq=The+time+machine,:+An+invention,&hl=&source=gbs_api",Biography & Autobiography,0,10.99,25,3.84
One Flew Over the Cuckoo's Nest,"The inspiration for the new Netflix original series Ratched Part of the Penguin Orange Collection, a limited-run series of twelve influential and beloved American classics in a bold series design offering a modern take on the iconic Penguin paperback Winner of the 2016 AIGA + Design Observer 50 Books | 50 Covers competition For the seventieth anniversary of Penguin Classics, the Penguin Orange Collection celebrates the heritage of Penguin‚Äôs iconic book design with twelve influential American literary classics representing the breadth and diversity of the Penguin Classics library. These collectible editions are dressed in the iconic orange and white tri-band cover design, first created in 1935, while french flaps, high-quality paper, and striking cover illustrations provide the cutting-edge design treatment that is the signature of Penguin Classics Deluxe Editions today. One Flew Over the Cuckoo‚Äôs Nest Boisterous, ribald, and ultimately shattering, Ken Kesey‚Äôs One Flew Over the Cuckoo‚Äôs Nest is a seminal novel of the 1960s. Here is the unforgettable story of a mental ward and its inhabitants‚Äîa counterculture classic that inspired the 1975 film adaptation, widely considered one of the greatest movies ever made.",Ken Kesey,http://books.google.com/books/content?id=KhRvDQAAQBAJ&printsec=frontcover&img=1&zoom=1&edge=curl&source=gbs_api,http://books.google.com/books?id=KhRvDQAAQBAJ&printsec=frontcover&dq=One+Flew+Over+the+Cuckoo%27s+Nest&hl=&cd=1&source=gbs_api,Penguin,2016/10/18,http://books.google.com/books?id=KhRvDQAAQBAJ&dq=One+Flew+Over+the+Cuckoo%27s+Nest&hl=&source=gbs_api,Fiction,0,16.9,9,4
Fiesta [The Sun Also Rises].,"First published in 1926, ‚ÄòThe Sun Also Rises‚Ä?is Ernest Hemingway‚Äôs first novel and a classic example of his spare but influential writing style. A poignant look at the disillusionment and angst of the post-World War I generation, the novel introduces two of Hemingway's most unforgettable characters: Jake Barnes and Lady Brett Ashley. Based on Hemingway's experiences, it is the story of a group of American and English expatriates living in Paris who take an excursion to Pamplona, Spain. The novel has forever associated Hemingway with bullfights and the running of the bulls. This powerful work of modern fiction, filled with memorable characters and universal themes, is summarized in this volume, which is enhanced by thought-provoking critical extracts and focused biographical details. The novel helped to establish Hemingway as one of the greatest writers of the twentieth century.",Ernest Hemingway,http://books.google.com/books/content?id=8cBvEAAAQBAJ&printsec=frontcover&img=1&zoom=1&edge=curl&source=gbs_api,http://books.google.com/books?id=8cBvEAAAQBAJ&pg=PP1&dq=Fiesta+%5BThe+Sun+Also+Rises%5D.&hl=&cd=1&source=gbs_api,DIGITAL FIRE,2022/5/15,https://play.google.com/store/books/details?id=8cBvEAAAQBAJ&source=gbs_api,Fiction,1,12.99,25,3.2
Slaughter-House Five (First paperback edition),"A special fiftieth anniversary edition of Kurt Vonnegut‚Äôs masterpiece, ‚Äúa desperate, painfully honest attempt to confront the monstrous crimes of the twentieth century‚Ä?(Time), featuring a new introduction by Kevin Powers, author of the National Book Award finalist The Yellow Birds Selected by the Modern Library as one of the 100 best novels of all time Slaughterhouse-Five, an American classic, is one of the world‚Äôs great antiwar books. Centering on the infamous World War II firebombing of Dresden, the novel is the result of what Kurt Vonnegut described as a twenty-three-year struggle to write a book about what he had witnessed as an American prisoner of war. It combines historical fiction, science fiction, autobiography, and satire in an account of the life of Billy Pilgrim, a barber‚Äôs son turned draftee turned optometrist turned alien abductee. As Vonnegut had, Billy experiences the destruction of Dresden as a POW. Unlike Vonnegut, he experiences time travel, or coming ‚Äúunstuck in time.‚Ä?An instant bestseller, Slaughterhouse-Five made Kurt Vonnegut a cult hero in American literature, a reputation that only strengthened over time, despite his being banned and censored by some libraries and schools for content and language. But it was precisely those elements of Vonnegut‚Äôs writing‚Äîthe political edginess, the genre-bending inventiveness, the frank violence, the transgressive wit‚Äîthat have inspired generations of readers not just to look differently at the world around them but to find the confidence to say something about it. Authors as wide-ranging as Norman Mailer, John Irving, Michael Crichton, Tim O‚ÄôBrien, Margaret Atwood, Elizabeth Strout, David Sedaris, Jennifer Egan, and J. K. Rowling have all found inspiration in Vonnegut‚Äôs words. Jonathan Safran Foer has described Vonnegut as ‚Äúthe kind of writer who made people‚Äîyoung people especially‚Äîwant to write.‚Ä?George Saunders has declared Vonnegut to be ‚Äúthe great, urgent, passionate American writer of our century, who offers us . . . a model of the kind of compassionate thinking that might yet save us from ourselves.‚Ä?Fifty years after its initial publication at the height of the Vietnam War, Vonnegut's portrayal of political disillusionment, PTSD, and postwar anxiety feels as relevant, darkly humorous, and profoundly affecting as ever, an enduring beacon through our own era‚Äôs uncertainties. ‚ÄúPoignant and hilarious, threaded with compassion and, behind everything, the cataract of a thundering moral statement.‚Äù‚ÄîThe Boston Globe",Kurt Vonnegut,http://books.google.com/books/content?id=pWyLDQAAQBAJ&printsec=frontcover&img=1&zoom=1&edge=curl&source=gbs_api,http://books.google.com/books?id=pWyLDQAAQBAJ&pg=PP1&dq=Slaughter-House+Five+(First+paperback+edition)&hl=&cd=1&source=gbs_api,Dial Press Trade Paperback,1999/1/12,http://books.google.com/books?id=pWyLDQAAQBAJ&dq=Slaughter-House+Five+(First+paperback+edition)&hl=&source=gbs_api,Fiction,1523,29.99,1,4
Rebecca,No description available,Unknown author,,,Unknown publisher,Unknown date,,Uncategorized,0,15.03,25,3.84
It's Not About the Bike: My Journey Back to Life,"The champion cyclist recounts his diagnosis with cancer, the grueling treatments during which he was given a less than twenty percent chance for survival, his surprising victory in the 1999 Tour de France, and the birth of his son.",Lance Armstrong,http://books.google.com/books/content?id=k16cS5-yuAQC&printsec=frontcover&img=1&zoom=1&edge=curl&source=gbs_api,http://books.google.com/books?id=k16cS5-yuAQC&printsec=frontcover&dq=It%27s+Not+About+the+Bike:+My+Journey+Back+to+Life&hl=&cd=1&source=gbs_api,Penguin,2001,http://books.google.com/books?id=k16cS5-yuAQC&dq=It%27s+Not+About+the+Bike:+My+Journey+Back+to+Life&hl=&source=gbs_api,Biography & Autobiography,45,16.68,13,2.92
Jonathan Livingston Seagull: A Story,"Jonathan Livingston Seagull, the most celebrated inspirational fable of our time, tells the story of a bird determined to be more than ordinary. This bestselling modern classic, reissued with a beautiful new cover design, is a story for people who want to follow their dreams and make their own rules and has inspired people for decades. `Most gulls don't bother to learn more than the simplest facts of flight how to get from shore to food and back again,' writes author Richard Bach in this allegory about a unique bird named Jonathan Livingston Seagull. `For most gulls it is not flying that matters, but eating. For this gull, though, it was not eating that mattered, but flight.' Flight is indeed the metaphor that makes this story soar. This bestselling modern classic is a fable about seeking a higher purpose in life, even if your flock, tribe or neighbourhood finds your ambition threatening (at one point our beloved gull is even banished from his flock). By not compromising his higher vision, Jonathan learns the meaning of love and kindness and gets the ultimate payoff transcendence. The dreamy illustrations by Russell Munson provide just the right illustrations for this spirituality classic that has inspired thousands of readers to follow their own path in life and so fulfill their true potential.",Richard Bach,,http://books.google.com/books?id=rQVlPgAACAAJ&dq=Jonathan+Livingston+Seagull:+A+Story&hl=&cd=1&source=gbs_api,Unknown publisher,2011,http://books.google.com/books?id=rQVlPgAACAAJ&dq=Jonathan+Livingston+Seagull:+A+Story&hl=&source=gbs_api,Fables,77,20.33,13,2.54
Treasure Island,"Treasure Island, published in 1883, popularized the now familiar characters of pirates and brought them to rum-swilling life. When an old sailor named Billy Bones dies in the inn belonging to young Jim Hawkins‚Äôs parents, he leaves a greasy old map on which an ‚ÄúX‚Ä?marks the spot where treasure is buried. Jim joins the crew of a ship in pursuit of Bones‚Äôs treasure, and on the seas meets up with Long John Silver, a peg-legged pirate who has infiltrated their ranks. Jim must survive mutinies and counter-mutinies, face hand-to-hand combat with drunken sailors, and outwit double-crossing thieves before the treasure can be his.",Robert Louis Stevenson,http://books.google.com/books/content?id=3dwNAAAAQAAJ&printsec=frontcover&img=1&zoom=1&edge=curl&source=gbs_api,http://books.google.com/books?id=3dwNAAAAQAAJ&printsec=frontcover&dq=Treasure+Island&hl=&cd=1&source=gbs_api,Bantam Classics,1883,https://play.google.com/store/books/details?id=3dwNAAAAQAAJ&source=gbs_api,Fiction,894,28.07,0,0
Bridge to Terabithia,"Tilly, Tom and Tiny from Tots TV have adventures in these pocket-sized books",Andrew Davenport,,http://books.google.com/books?id=WZkxmgEACAAJ&dq=Bridge+to+Terabithia&hl=&cd=1&source=gbs_api,Unknown publisher,1995,http://books.google.com/books?id=WZkxmgEACAAJ&dq=Bridge+to+Terabithia&hl=&source=gbs_api,Children's stories,9,13.43,25,3.4
A Tale of Two Cities - Literary Touchstone Edition,"This Prestwick House Literary Touchstone Edition? includes a glossary and reader's notes to help the modern reader contend with Dickens's complex approach to the human condition.Set against the backdrop of the French Revolution, A Tale of Two Cities remains one of Western literature's most powerful stories of sacrificial love, redemption, and the devastation spread by obsessive justice. Having fled Paris for the relative safety and security of London, Dr. Manette, his daughter Lucie, and Charles Darnay are irresistibly lured into a whirlwind of events that threaten to shatter their lives'until a hopeless drunkard remembers the promise he once made to the only woman he ever loved. Dickens originally published A Tale of Two Cities in weekly installments, ensuring that his readers would return to read each new segment. The collected chapters have continued to excite and move readers for over a century.",Charles Dickens,http://books.google.com/books/content?id=s_poeXrlaykC&printsec=frontcover&img=1&zoom=1&edge=curl&source=gbs_api,http://books.google.com/books?id=s_poeXrlaykC&printsec=frontcover&dq=A+Tale+of+Two+Cities+-+Literary+Touchstone+Edition&hl=&cd=1&source=gbs_api,Prestwick House Inc,2005,https://play.google.com/store/books/details?id=s_poeXrlaykC&source=gbs_api,Executions and executioners,0,17.99,25,3.6
The Lord of the Rings: The Fellowship of the Ring (BBC Audio Collection),No description available,Unknown author,http://books.google.com/books/content?id=UNhZjwEACAAJ&printsec=frontcover&img=1&zoom=1&source=gbs_api,http://books.google.com/books?id=UNhZjwEACAAJ&dq=The+Lord+of+the+Rings:+The+Fellowship+of+the+Ring+(BBC+Audio+Collection)&hl=&cd=1&source=gbs_api,Unknown publisher,2002,http://books.google.com/books?id=UNhZjwEACAAJ&dq=The+Lord+of+the+Rings:+The+Fellowship+of+the+Ring+(BBC+Audio+Collection)&hl=&source=gbs_api,Uncategorized,0,25.99,0,0
Snow Crash,"The ‚Äúbrilliantly realized‚Ä?(The New York Times Book Review) modern classic that coined the term ‚Äúmetaverse‚Äù‚Äîone of Time‚Äôs 100 best English-language novels and ‚Äúa foundational text of the cyberpunk movement‚Ä?(Wired) In reality, Hiro Protagonist delivers pizza for Uncle Enzo‚Äôs CosoNostra Pizza Inc., but in the Metaverse he‚Äôs a warrior prince. Plunging headlong into the enigma of a new computer virus that‚Äôs striking down hackers everywhere, he races along the neon-lit streets on a search-and-destroy mission for the shadowy virtual villain threatening to bring about infocalypse. Snow Crash is a mind-altering romp through a future America so bizarre, so outrageous . . . you‚Äôll recognize it immediately.",Neal Stephenson,http://books.google.com/books/content?id=RMd3GpIFxcUC&printsec=frontcover&img=1&zoom=1&edge=curl&source=gbs_api,http://books.google.com/books?id=RMd3GpIFxcUC&printsec=frontcover&dq=Snow+Crash&hl=&cd=1&source=gbs_api,Spectra,2003/8/26,https://play.google.com/store/books/details?id=RMd3GpIFxcUC&source=gbs_api,Fiction,363,19.99,25,2.64
The Call Of The Wild,No description available,Jack London,http://books.google.com/books/content?id=xFIYAAAAYAAJ&printsec=frontcover&img=1&zoom=1&edge=curl&source=gbs_api,http://books.google.com/books?id=xFIYAAAAYAAJ&printsec=frontcover&dq=The+Call+Of+The+Wild&hl=&cd=1&source=gbs_api,Unknown publisher,1903,https://play.google.com/store/books/details?id=xFIYAAAAYAAJ&source=gbs_api,American fiction,1,19.99,25,4.28
"The grapes of wrath, (The living library)",No description available,John Steinbeck,,"http://books.google.com/books?id=uiknvgAACAAJ&dq=The+grapes+of+wrath,+(The+living+library)&hl=&cd=1&source=gbs_api",Castrovilli Giuseppe,1947,"http://books.google.com/books?id=uiknvgAACAAJ&dq=The+grapes+of+wrath,+(The+living+library)&hl=&source=gbs_api",California,58,18.99,0,0
Darkfever (Fever Series),"MacKayla Lane‚Äôs life is good. She has great friends, a decent job, and a car that breaks down only every other week or so. In other words, she‚Äôs your perfectly ordinary twenty-first-century woman. Or so she thinks . . . until something extraordinary happens. When her sister is murdered, leaving a single clue to her death‚Äîa cryptic message on Mac‚Äôs cell phone‚ÄîMac journeys to Ireland in search of answers. The quest to find her sister‚Äôs killer draws her into a shadowy realm where nothing is as it seems, where good and evil wear the same treacherously seductive mask. She is soon faced with an even greater challenge: staying alive long enough to learn how to handle a power she had no idea she possessed‚Äìa gift that allows her to see beyond the world of man, into the dangerous realm of the Fae. . . . As Mac delves deeper into the mystery of her sister‚Äôs death, her every move is shadowed by the dark, mysterious Jericho, a man with no past and only mockery for a future. As she begins to close in on the truth, the ruthless Vlane‚Äîan alpha Fae who makes sex an addiction for human women‚Äìcloses in on her. And as the boundary between worlds begins to crumble, Mac‚Äôs true mission becomes clear: find the elusive Sinsar Dubh before someone else claims the all-powerful Dark Book‚Äîbecause whoever gets to it first holds nothing less than complete control of the very fabric of both worlds in their hands. . . . Look for all of Karen Marie Moning‚Äôs sensational Fever novels: DARKFEVER | BLOODFEVER | FAEFEVER | DREAMFEVER | SHADOWFEVER | ICED | BURNED | FEVERBORN | FEVERSONG BONUS: This edition contains an excerpt from Karen Marie Moning's Bloodfever.",Karen Marie Moning,http://books.google.com/books/content?id=tli3oYByCTYC&printsec=frontcover&img=1&zoom=1&edge=curl&source=gbs_api,http://books.google.com/books?id=tli3oYByCTYC&printsec=frontcover&dq=Darkfever+(Fever+Series)&hl=&cd=1&source=gbs_api,Delacorte Press,2006/10/31,https://play.google.com/store/books/details?id=tli3oYByCTYC&source=gbs_api,Fiction,2274,17.99,13,2.69
