Title,description,authors,image,previewLink,publisher,publishedDate,infoLink,categories,ratingsCount,Price,review_count,avg_rating
Economics in one lesson,"With over a million copies sold, Economics in One Lesson is an essential guide to the basics of economic theory. A fundamental influence on modern libertarianism, Hazlitt defends capitalism and the free market from economic myths that persist to this day. Considered among the leading economic thinkers of the ‚ÄúAustrian School,‚Ä?which includes Carl Menger, Ludwig von Mises, Friedrich (F.A.) Hayek, and others, Henry Hazlitt (1894-1993), was a libertarian philosopher, an economist, and a journalist. He was the founding vice-president of the Foundation for Economic Education and an early editor of The Freeman magazine, an influential libertarian publication. Hazlitt wrote Economics in One Lesson, his seminal work, in 1946. Concise and instructive, it is also deceptively prescient and far-reaching in its efforts to dissemble economic fallacies that are so prevalent they have almost become a new orthodoxy. Economic commentators across the political spectrum have credited Hazlitt with foreseeing the collapse of the global economy which occurred more than 50 years after the initial publication of Economics in One Lesson. Hazlitt‚Äôs focus on non-governmental solutions, strong ‚Ä?and strongly reasoned ‚Ä?anti-deficit position, and general emphasis on free markets, economic liberty of individuals, and the dangers of government intervention make Economics in One Lesson every bit as relevant and valuable today as it has been since publication.",Henry Hazlitt,http://books.google.com/books/content?id=A50iBxwt7qMC&printsec=frontcover&img=1&zoom=1&edge=curl&source=gbs_api,http://books.google.nl/books?id=A50iBxwt7qMC&printsec=frontcover&dq=Economics+in+one+lesson&hl=&cd=1&source=gbs_api,Currency,2010/8/11,https://play.google.com/store/books/details?id=A50iBxwt7qMC&source=gbs_api,Business & Economics,18,29.99,13,3.38
The Scarlet Letter A Romance,No description available,Unknown author,,,Unknown publisher,Unknown date,,Uncategorized,0,26.99,5,4.2
The Dharma Bums,"THE DHARMA BUMS appeared just one year after the author's explosive ON THE ROAD had put the Beat Generation on the literary map and Kerouac on the best-seller list. The same expansiveness, humour and contagious zest for life that sparked the earlier novels sparks this one too, but through a more cohesive story. The books follow two young men engaged in a passionate search for dharma or truth. Their major adventure is the pursuit of the Zen way, which takes them climbing into the high sierras to seek the lesson of solitude. With an Introduction by Kerouac expert, Ann Douglas.",Jack Kerouac,http://books.google.com/books/content?id=hrJdIzWZWS4C&printsec=frontcover&img=1&zoom=1&source=gbs_api,http://books.google.nl/books?id=hrJdIzWZWS4C&dq=The+Dharma+Bums&hl=&cd=1&source=gbs_api,Penguin UK,2000,http://books.google.nl/books?id=hrJdIzWZWS4C&dq=The+Dharma+Bums&hl=&source=gbs_api,Fiction,0,13.99,9,4.67
Foundation,"Voor trainers is er gratis extra materiaal bij dit boek beschikbaar. Dit is te vinden onder het tabblad Training Material . Log in met uw trainersaccount om het materiaal te raadplegen. Over de serie I-TracksBinnen I-Tracks kan iedereen die zich (verder) wil scholen op het gebied van de ICT zijn eigen individuele leerrichting kiezen op basis van eerder verworven kennis en competenties. Binnen de diverse opleidingstrajecten komen zowel theoretische als praktische vaardigheden aan bod. Er kunnen diverse soorten opleidingstrajecten gekozen worden. Short Tracks om binnen een korte doorlooptijd binnen een specifiek gebied kennis op te doen zoals security- of projectmanagement. Daarnaast zijn er diverse functiegerichte opleidingen, zoals Systeembeheerder en Helpdesk medewerker, waarin op basis van de functieprofielen en competenties opleidingstrajecten zijn samengesteld. Deze trajecten worden CareerTracks genoemd.Als laatste zijn er Academy Tracks; een complete ICT-opleiding op HBO-niveau in de volgende richtingen: Service Management, Information Management en System Developer.Bij Van Haren Publishing wordt een serie (leer)boeken ontwikkeld die ieder de totale examenstof dekken voor √©√©n I-Tracks module. Daarnaast zijn andere uitgaven van Van Haren Publishing aangemerkt als (kern-)literatuur voor een I-Tracks module.",K. Louwman,http://books.google.com/books/content?id=GGNeAgAAQBAJ&printsec=frontcover&img=1&zoom=1&edge=curl&source=gbs_api,http://books.google.nl/books?id=GGNeAgAAQBAJ&pg=PR2&dq=Foundation&hl=&cd=1&source=gbs_api,Van Haren,2012/1/1,http://books.google.nl/books?id=GGNeAgAAQBAJ&dq=Foundation&hl=&source=gbs_api,Education,0,14.99,9,4.11
Romeo and Juliet,No description available,William Shakespeare,http://books.google.com/books/content?id=6rhaAAAAcAAJ&printsec=frontcover&img=1&zoom=1&edge=curl&source=gbs_api,http://books.google.nl/books?id=6rhaAAAAcAAJ&printsec=frontcover&dq=Romeo+and+Juliet&hl=&cd=1&source=gbs_api,Unknown publisher,1734,https://play.google.com/store/books/details?id=6rhaAAAAcAAJ&source=gbs_api,Uncategorized,0,22.56,7,5
The Clan of the Cave Bear,"An all-absorbing journey into man's possible past. Jean M. Auel, a storytelling genius, weaves a compellingly readable saga of human survival; an epic that transcends time and place. It is peopled with rich and complex characters who experience the full range of human emotions. All this makes for total involvement and believability in the light of today. A novel for all time. Copyright ¬© Libri GmbH. All rights reserved.",Jean M. Auel,http://books.google.com/books/content?id=syQWIcXFlkkC&printsec=frontcover&img=1&zoom=1&source=gbs_api,http://books.google.nl/books?id=syQWIcXFlkkC&q=The+Clan+of+the+Cave+Bear&dq=The+Clan+of+the+Cave+Bear&hl=&cd=1&source=gbs_api,Unknown publisher,1981,http://books.google.nl/books?id=syQWIcXFlkkC&dq=The+Clan+of+the+Cave+Bear&hl=&source=gbs_api,American fiction,145,23.99,14,2.93
1984,"Nieuwspraak, Big Brother, het vocabulaire uit 1984 is in onze taal opgenomen en een eigen leven gaan leiden. De roman van George Orwell uit 1949 over de strijd van Winston Smith, ambtenaar op het ministerie van Waarheid, tegen de alles doordringende Partij, en zijn gedoemde liefde voor Julia heeft niets van zijn literarie zeggingskracht verloren. In Orwells steeds weer herdrukte anti-utopie verkeert de wereld in de wurggreep van een systeem dat is gegrondvest op de verbreiding van angst, haat en wreedheid, en dat iedere vorm van persoonlijke vrijheid en indiviualiteit uitsluit. 1984 is onverminderd geldig als benauwend nauwkeurig blauwdruk van elk dictatoriaal regime.",George Orwell,http://books.google.com/books/content?id=gTx1AAAAQBAJ&printsec=frontcover&img=1&zoom=1&edge=curl&source=gbs_api,http://books.google.nl/books?id=gTx1AAAAQBAJ&printsec=frontcover&dq=1984&hl=&cd=1&source=gbs_api,Singel Uitgeverijen,2013/5/16,https://play.google.com/store/books/details?id=gTx1AAAAQBAJ&source=gbs_api,Fiction,0,11.14,13,4.08
Fahrenheit 451,No description available,Ray Bradbury,http://books.google.com/books/content?id=yEuuoAEACAAJ&printsec=frontcover&img=1&zoom=1&source=gbs_api,http://books.google.nl/books?id=yEuuoAEACAAJ&dq=Fahrenheit+451&hl=&cd=1&source=gbs_api,Unknown publisher,2012,http://books.google.nl/books?id=yEuuoAEACAAJ&dq=Fahrenheit+451&hl=&source=gbs_api,Book burning,1,18.83,9,4.56
One Hundred Years of Solitude,The evolution and eventual decadence of a small South American town is mirrored in the family history of the Buendias.,Gabriel Garc√≠a M√°rquez,http://books.google.com/books/content?id=w0-zUL-87uAC&printsec=frontcover&img=1&zoom=1&source=gbs_api,http://books.google.nl/books?id=w0-zUL-87uAC&q=One+Hundred+Years+of+Solitude&dq=One+Hundred+Years+of+Solitude&hl=&cd=1&source=gbs_api,Everyman's Library,1995,http://books.google.nl/books?id=w0-zUL-87uAC&dq=One+Hundred+Years+of+Solitude&hl=&source=gbs_api,Fiction,261,13.99,25,3.64
Prey,"Tropical rainforests cover only about 6% of the earth's surface, yet they are home to more than half the world's species. This book looks at the biology and behaviour of predators and prey describing how they live together in harmony and balance and how vital they are to the wellbeing of the whole world. It is one of a series of books which aims to provide an understanding of the unique ecosystems of the rainforest. It describes the amazing plants and animals and how they interact, and addresses local and global environmental and conservation issues.",Michael Chinery,http://books.google.com/books/content?id=9-ccs-5g6gwC&printsec=frontcover&img=1&zoom=1&edge=curl&source=gbs_api,http://books.google.nl/books?id=9-ccs-5g6gwC&pg=PA25&dq=Prey&hl=&cd=1&source=gbs_api,Cherrytree Books,2000,http://books.google.nl/books?id=9-ccs-5g6gwC&dq=Prey&hl=&source=gbs_api,Predation (Biology),0,24.4,25,3.04
Leaves of Grass,Dit boek is onderdeel van de TREDITION CLASSICS serie. De makers van deze serie zijn verbonden door hun passie voor literatuur en gedreven met de bedoeling om alle publieke domein boeken weer gedrukte vorm beschikbaar te maken - wereldwijd. De meeste geprinte TREDITION CLASSICS titels zijn al decennia verdwenen uit de boekenkasten. Bij tredition geloven wij dat een goed boek nooit uit de mode is en dat zijn waarde voor eeuwig is. Deze boeken serie helpt bij het behouden van de literatuur schatten. Het draagt bij in het behouden van prachtige wereldliteratuur werken.,Walt Whitman,http://books.google.com/books/content?id=QPJqmwEACAAJ&printsec=frontcover&img=1&zoom=1&source=gbs_api,http://books.google.nl/books?id=QPJqmwEACAAJ&dq=Leaves+of+Grass&hl=&cd=1&source=gbs_api,Tredition Classics,Apr-13,http://books.google.nl/books?id=QPJqmwEACAAJ&dq=Leaves+of+Grass&hl=&source=gbs_api,Uncategorized,0,21.37,5,4
Of Mice and Men (Penguin Audiobooks),"Penguin Classics presents John Steinbeck‚Äôs classic tale as an eBook enhanced with ten exclusive video clips featuring students responses, questions for classroom discussions, and an American Dream assignment Nobel Prize-winner John Steinbeck‚Äôs Of Mice and Men remains one of America's most widely read and taught novels. An unlikely pair, George and Lennie, two migrant workers in California during the Great Depression, grasp for their American Dream. Laborers in California's dusty vegetable fields, they hustle work when they can, living a hand-to-mouth existence. For George and Lennie have a plan: to own an acre of land and a shack they can call their own. When they land jobs on a ranch in the Salinas Valley, the fulfillment of their dream seems to be within their grasp. But even George cannot guard Lennie from the provocations, nor predict the consequences of Lennie's unswerving obedience to the things George taught him. Of Mice and Men: Teacher‚Äôs Edition includes the following: ‚Ä?An introduction and suggested further reading by Susan Shillinglaw, a professor of English at San Jose State University and Scholar-in-Residence at the National Steinbeck Center in Salinas ‚Ä?The poem ‚ÄúTo a Mouse, On Turning Her Up in Her Nest with the Plough, November 1785‚Ä?by Robert Burns (the original source of Steinbeck‚Äôs title Of Mice and Men) ‚Ä?The 1962 Nobel Banquet Speech by John Steinbeck ‚Ä?An exclusive audio interview with award-winning actor James Earl Jones on his stage performances in Of Mice and Men ‚Ä?Ten exclusive videos of students on major themes from the novel tied to group discussion questions included in the eBook, and an American Dream assignment, for the ultimate educational experience",John Steinbeck,http://books.google.com/books/content?id=gpwqbgA0m5EC&printsec=frontcover&img=1&zoom=1&edge=curl&source=gbs_api,http://books.google.nl/books?id=gpwqbgA0m5EC&printsec=frontcover&dq=Of+Mice+and+Men+(Penguin+Audiobooks)&hl=&cd=1&source=gbs_api,Penguin,2013/1/3,https://play.google.com/store/books/details?id=gpwqbgA0m5EC&source=gbs_api,Fiction,0,21.99,25,3.96
The Greatest Generation,"Focuses on the generation of Americans who were born in the 1920s, came of age during the Depression, fought in World War II, and came home to build a new America during the postwar era.",Tom Brokaw,http://books.google.com/books/content?id=sDn74fsLzVYC&printsec=frontcover&img=1&zoom=1&source=gbs_api,http://books.google.nl/books?id=sDn74fsLzVYC&q=The+Greatest+Generation&dq=The+Greatest+Generation&hl=&cd=1&source=gbs_api,Delta,May-01,http://books.google.nl/books?id=sDn74fsLzVYC&dq=The+Greatest+Generation&hl=&source=gbs_api,History,5,29.99,9,3.78
A Princess of Mars,"A Virginia gentleman finds himself transported from Civil War-era America to Mars, where he plots, along with the lovely Princess of Theluim, to escape from his savage green captors",Edgar Rice Burroughs,http://books.google.com/books/content?id=B_4OAQAAMAAJ&printsec=frontcover&img=1&zoom=1&source=gbs_api,http://books.google.nl/books?id=B_4OAQAAMAAJ&q=A+Princess+of+Mars&dq=A+Princess+of+Mars&hl=&cd=1&source=gbs_api,Barsoom,1963,http://books.google.nl/books?id=B_4OAQAAMAAJ&dq=A+Princess+of+Mars&hl=&source=gbs_api,Fiction,0,15.76,13,4.46
Night,"Here is the wonderful new version of the classic poem every family should own. This edition of The Night Before Christmas lavishly illustrated by renowned artist Charles Santore, the critically-acclaimed illustrator of The Wizard of Oz, Snow White, The Little Mermaid, and others. This is a hardcover edition of the classic The Night Before Christmas, featuring a four-page gatefold and an embossed and foil-stamped cover. Since it was first published anonymously in 1823, The Night Before Christmas has enchanted children with the story of St. Nicholas climbing down the chimney and filling all the stockings before springing back to his sleigh. Many families read the poem every year, and now they have a beautiful hardcover edition to treasure. The cherished poem, faithfully reproduced here, is accompanied by Charles Santore‚Äôs stunning illustrations.",Clement Moore,http://books.google.com/books/content?id=LSSyDwAAQBAJ&printsec=frontcover&img=1&zoom=1&edge=curl&source=gbs_api,http://books.google.nl/books?id=LSSyDwAAQBAJ&printsec=frontcover&dq=Night&hl=&cd=1&source=gbs_api,Applesauce Press,2011/10/11,http://books.google.nl/books?id=LSSyDwAAQBAJ&dq=Night&hl=&source=gbs_api,Juvenile Fiction,1,15.99,14,3.93
A Tree Grows in Brooklyn,A young girl from an impoverished family comes of age in Brooklyn at the turn of the twentieth century.,Betty Smith,http://books.google.com/books/content?id=Sn2IyeVuVK0C&printsec=frontcover&img=1&zoom=1&source=gbs_api,http://books.google.nl/books?id=Sn2IyeVuVK0C&dq=A+Tree+Grows+in+Brooklyn&hl=&cd=1&source=gbs_api,Random House,Sep-92,http://books.google.nl/books?id=Sn2IyeVuVK0C&dq=A+Tree+Grows+in+Brooklyn&hl=&source=gbs_api,Fiction,0,13.99,5,4.4
Mere Christianity,"In the classic Mere Christianity, C.S. Lewis, the most important writer of the 20th century, explores the common ground upon which all of those of Christian faith stand together. Bringing together Lewis‚Ä?legendary broadcast talks during World War Two from his three previous books The Case for Christianity, Christian Behavior, and Beyond Personality, Mere Christianity provides an unequaled opportunity for believers and nonbelievers alike to hear this powerful apologetic for the Christian faith.",C. S. Lewis,http://books.google.com/books/content?id=OF-YSMKCVwMC&printsec=frontcover&img=1&zoom=1&edge=curl&source=gbs_api,http://books.google.nl/books?id=OF-YSMKCVwMC&printsec=frontcover&dq=Mere+Christianity&hl=&cd=1&source=gbs_api,Harper Collins,2009/6/2,https://play.google.com/store/books/details?id=OF-YSMKCVwMC&source=gbs_api,Religion,205,25.34,5,4.2
The Other Boleyn Girl,"The daughters of a ruthlessly ambitious family, Mary and Anne Boleyn are sent to the court of Henry VIII to attract the attention of the king, who first takes Mary as his mistress, in which role she bears him an illegitimate son, and then Anne as his wife. Reprint. 250,000 first printing. (A Columbia Pictures film, written by Peter Morgan, directed by Justin Chadwick, releasing Fall 2007, starring Natalie Portman, Scarlett Johansson, Eric Bana, and others) (Historical Fiction)",Philippa Gregory,http://books.google.com/books/content?id=XiRWX3kt0XYC&printsec=frontcover&img=1&zoom=1&edge=curl&source=gbs_api,http://books.google.nl/books?id=XiRWX3kt0XYC&printsec=frontcover&dq=The+Other+Boleyn+Girl&hl=&cd=1&source=gbs_api,Simon and Schuster,2008/1/22,http://books.google.nl/books?id=XiRWX3kt0XYC&dq=The+Other+Boleyn+Girl&hl=&source=gbs_api,Fiction,285,15.99,25,2
Lord of the flies,"William Golding‚Äôs unforgettable classic of boyhood adventure and the savagery of humanity comes to Penguin Classics in a stunning Graphic Deluxe Edition with a new foreword by Lois Lowry As provocative today as when it was first published in 1954, Lord of the Flies continues to ignite passionate debate with its startling, brutal portrait of human nature. William Golding‚Äôs compelling story about a group of very ordinary boys marooned on a coral island has been labeled a parable, an allegory, a myth, a morality tale, a parody, a political treatise, and even a vision of the apocalypse. But above all, it has earned its place as one of the indisputable classics of the twentieth century for readers of any age. This Penguin Classics Graphic Deluxe Edition features an array of special features to supplement the novel, including a foreword by Lois Lowry, an introduction by Stephen King, an essay by E. M. Forster, an essay on teaching and reading the novel and suggestions for further exploration by scholar Jennifer Buehler, and an extended note by E. L. Epstein, the publisher of the first American paperback edition of Lord of the Flies. For more than seventy years, Penguin has been the leading publisher of classic literature in the English-speaking world. With more than 1,700 titles, Penguin Classics represents a global bookshelf of the best works throughout history and across genres and disciplines. Readers trust the series to provide authoritative texts enhanced by introductions and notes by distinguished scholars and contemporary authors, as well as up-to-date translations by award-winning translators.",William Golding,http://books.google.com/books/content?id=r6eoCwAAQBAJ&printsec=frontcover&img=1&zoom=1&edge=curl&source=gbs_api,http://books.google.nl/books?id=r6eoCwAAQBAJ&printsec=frontcover&dq=Lord+of+the+flies&hl=&cd=1&source=gbs_api,Penguin,2016/11/15,https://play.google.com/store/books/details?id=r6eoCwAAQBAJ&source=gbs_api,Fiction,2861,22.12,13,3.08
Ulysses,"Beschrijving van achttien episoden van √©√©n dag uit het leven van een Joodse advertentiecolporteur in Dublin in het jaar 1904, waarbij schr. zich spiegelt aan de ""Odyssee"" van Homerus.",James Augustine Aloysius Joyce,,http://books.google.nl/books?id=7hAaQgAACAAJ&dq=Ulysses&hl=&cd=1&source=gbs_api,Unknown publisher,1984,http://books.google.nl/books?id=7hAaQgAACAAJ&dq=Ulysses&hl=&source=gbs_api,Uncategorized,0,27.99,5,2.8
The Stranger,"The Stranger appears out of nowhere, perhaps in a bar, or a parking lot, or at the grocery store. His identity is unknown. His motives are unclear. His information is undeniable. Then he whispers a few words in your ear and disappears, leaving you picking up the pieces of your shattered world. Adam Price has a lot to lose: a comfortable marriage to a beautiful woman, two wonderful sons, and all the trappings of the American Dream: a big house, a good job, a seemingly perfect life. Then he runs into the Stranger. When he learns a devastating secret about his wife, Corrine, he confronts her, and the mirage of perfection disappears as if it never existed at all. Soon Adam finds himself tangled in something far darker than even Corrine's deception, and realizes that if he doesn't make exactly the right moves, the conspiracy he's stumbled into will not only ruin lives - it will end them...",Harlan Coben,http://books.google.com/books/content?id=8l0WswEACAAJ&printsec=frontcover&img=1&zoom=1&source=gbs_api,http://books.google.nl/books?id=8l0WswEACAAJ&dq=The+Stranger&hl=&cd=1&source=gbs_api,Orion,2016/1/28,http://books.google.nl/books?id=8l0WswEACAAJ&dq=The+Stranger&hl=&source=gbs_api,Uncategorized,15,19.99,5,4.2
"Monte Cristo,","The Count of Monte Cristo (French: Le Comte de Monte-Cristo) is an adventure novel by French author Alexandre Dumas completed in 1844. It is one of the author's most popular works, along with The Three Musketeers. Like many of his novels, it is expanded from plot outlines suggested by his collaborating ghostwriter Auguste Maquet.The story takes place in France, Italy, and islands in the Mediterranean during the historical events of 1815-1839: the era of the Bourbon Restoration through the reign of Louis-Philippe of France. It begins just before the Hundred Days period (when Napoleon returned to power after his exile). The historical setting is a fundamental element of the book, an adventure story primarily concerned with themes of hope, justice, vengeance, mercy, and forgiveness. It centres around a man who is wrongfully imprisoned, escapes from jail, acquires a fortune, and sets about getting revenge on those responsible for his imprisonment. However, his plans have devastating consequences for the innocent as well as the guilty. In addition, it is a story that involves romance, loyalty, betrayal, and selfishness, shown throughout the story as characters slowly reveal their true inner nature.The book is considered a literary classic today. According to Luc Sante, ""The Count of Monte Cristo has become a fixture of Western civilization's literature, as inescapable and immediately identifiable as Mickey Mouse, Noah's flood, and the story of Little Red Riding Hood.",Alexandre Dumas,http://books.google.com/books/content?id=RyEEAAAAQAAJ&printsec=frontcover&img=1&zoom=1&edge=curl&source=gbs_api,"http://books.google.nl/books?id=RyEEAAAAQAAJ&printsec=frontcover&dq=Monte+Cristo,&hl=&cd=1&source=gbs_api",Unknown publisher,1846,https://play.google.com/store/books/details?id=RyEEAAAAQAAJ&source=gbs_api,Uncategorized,77,12.21,25,4.08
Dune,"Immerse yourself in the world of Denis Villeneuve‚Äôs Dune and discover the incredible creative journey that brought Frank Herbert‚Äôs iconic novel to the big screen. Frank Herbert‚Äôs science fiction classic Dune has been brought to life like never before in the breathtaking film adaptation from acclaimed director Denis Villeneuve (Blade Runner 2049, Arrival). Now fans can be part of this creative journey with The Art and Soul of Dune, the official companion to the hugely anticipated movie event. Written by Dune executive producer Tanya Lapointe, this visually dazzling exploration of the filmmaking process gives unparalleled insight into the project‚Äôs genesis‚Äîfrom its striking environmental and creature designs to its intricate costume concepts and landmark digital effects. The Art and Soul of Dune also features exclusive interviews with key members of the cast and crew, including Denis Villeneuve, Timoth√©e Chalamet, Rebecca Ferguson, Oscar Isaac, and many more, delivering a uniquely candid account of the hugely ambitious international shoot. Showcasing Villeneuve‚Äôs visionary approach to realizing Herbert‚Äôs science fiction classic, The Art and Soul of Dune is an essential companion to the director‚Äôs latest masterpiece.",Tanya Lapointe,http://books.google.com/books/content?id=aQ9UEAAAQBAJ&printsec=frontcover&img=1&zoom=1&edge=curl&source=gbs_api,http://books.google.nl/books?id=aQ9UEAAAQBAJ&printsec=frontcover&dq=Dune&hl=&cd=1&source=gbs_api,Simon and Schuster,2021/10/22,http://books.google.nl/books?id=aQ9UEAAAQBAJ&dq=Dune&hl=&source=gbs_api,Art,0,14.04,25,2.96
"Julie and Julia: 365 Days, 524 Recipes, 1 Tiny Apartment Kitchen: How One Girl Risked Her Marriage, Her Job, and Her ... Living","Pushing thirty, living in a rundown apartment in Queens and working at a dead-end secretarial job, Julie Powell is, in a word, stuck. In her desperate search for an escape, she comes up instead with The Project - a deranged assignment, to take her mother's dog-eared copy of Julia Child's 1961 classic Mastering the Art of French Cooking and cook all 524 recipes. In the span of one year.",Julie Powell,http://books.google.com/books/content?id=DTyvAAAACAAJ&printsec=frontcover&img=1&zoom=1&source=gbs_api,"http://books.google.nl/books?id=DTyvAAAACAAJ&dq=Julie+and+Julia:+365+Days,+524+Recipes,+1+Tiny+Apartment+Kitchen:+How+One+Girl+Risked+Her+Marriage,+Her+Job,+and+Her+...+Living&hl=&cd=1&source=gbs_api",Viking,2005,"http://books.google.nl/books?id=DTyvAAAACAAJ&dq=Julie+and+Julia:+365+Days,+524+Recipes,+1+Tiny+Apartment+Kitchen:+How+One+Girl+Risked+Her+Marriage,+Her+Job,+and+Her+...+Living&hl=&source=gbs_api","Cookery, French",5,26.54,25,1.56
Practical Magic,No description available,Nikki Van De Car,,http://books.google.nl/books?id=jA8iyQEACAAJ&dq=Practical+Magic&hl=&cd=1&source=gbs_api,Unknown publisher,2019,http://books.google.nl/books?id=jA8iyQEACAAJ&dq=Practical+Magic&hl=&source=gbs_api,Uncategorized,0,22.99,7,3.29
Jane Eyre,No description available,Charlotte Bront√´,,http://books.google.nl/books?id=cNDbtAEACAAJ&dq=Jane+Eyre&hl=&cd=1&source=gbs_api,Unknown publisher,Oct-17,http://books.google.nl/books?id=cNDbtAEACAAJ&dq=Jane+Eyre&hl=&source=gbs_api,Literary Criticism,0,20.98,13,4.46
