Title,description,authors,image,previewLink,publisher,publishedDate,infoLink,categories,ratingsCount,Price,review_count,avg_rating
Kushiel's Dart,"Fifty Shades of Grey meets Game of Thrones, Kushiel's Dart is the first in a triptych of beautifully constructed historical fantasies that combine passion, danger, great battles, and deep eroticism. The land of Terre d‚ÄôAnge is a place of unsurpassing beauty and grace. It is said that the angels found the land and saw it was good... and the ensuing race that rose from the seed of angels and men live by one simple rule: Love as thou wilt. Ph√®dre n√≥ Delaunay is a young woman who was born with a scarlet mote in her left eye and sold into indentured servitude as a child. Her bond is purchased by Anafiel Delaunay, a nobleman with a very special mission... and the first one to recognize who and what she is: one pricked by Kushiel‚Äôs Dart, chosen to forever experience pain and pleasure as one. Ph√®dre is trained equally in the courtly arts and the talents of the bedchamber, but, above all, in the ability to observe, remember, and analyze. Almost as talented a spy as she is a courtesan, Ph√®dre stumbles upon a plot that threatens the very foundation of her homeland. Treachery sets her on her path; love and honor goad her further and will take her to the edge of despair... and beyond. Hateful friend, loving enemy, beloved assassin; they can all wear the same glittering mask in this world, and Ph√®dre will get but one chance to save all that she holds dear. Set in a world of cunning poets, deadly courtiers, heroic traitors, and a truly Machiavellian villainess, this is a novel of grandeur, luxuriance, sacrifice, betrayal, and deeply laid conspiracies. Not since Dune has there been an epic on the scale of Kushiel's Dart‚Äîa massive tale about the violent death of an old age and the birth of a new.",Jacqueline Carey,http://books.google.com/books/content?id=g0jPyQEACAAJ&printsec=frontcover&img=1&zoom=1&source=gbs_api,http://books.google.com/books?id=g0jPyQEACAAJ&dq=Kushiel%27s+Dart&hl=&cd=1&source=gbs_api,Tor Fantasy,2020/6/30,http://books.google.com/books?id=g0jPyQEACAAJ&dq=Kushiel%27s+Dart&hl=&source=gbs_api,Fiction,118,20.99,9,2.44
Cat's Cradle,"‚ÄúA free-wheeling vehicle . . . an unforgettable ride!‚Äù‚ÄîThe New York Times Cat‚Äôs Cradle is Kurt Vonnegut‚Äôs satirical commentary on modern man and his madness. An apocalyptic tale of this planet‚Äôs ultimate fate, it features a midget as the protagonist, a complete, original theology created by a calypso singer, and a vision of the future that is at once blackly fatalistic and hilariously funny. A book that left an indelible mark on an entire generation of readers, Cat‚Äôs Cradle is one of the twentieth century‚Äôs most important works‚Äîand Vonnegut at his very best. ‚Äú[Vonnegut is] an unimitative and inimitable social satirist.‚Äù‚ÄîHarper‚Äôs Magazine ‚ÄúOur finest black-humorist . . . We laugh in self-defense.‚Äù‚ÄîAtlantic Monthly",Kurt Vonnegut,http://books.google.com/books/content?id=w25sx0G6nRsC&printsec=frontcover&img=1&zoom=1&edge=curl&source=gbs_api,http://books.google.com/books?id=w25sx0G6nRsC&printsec=frontcover&dq=Cat%27s+Cradle&hl=&cd=1&source=gbs_api,Dial Press,2009/11/4,https://play.google.com/store/books/details?id=w25sx0G6nRsC&source=gbs_api,Fiction,157,27.99,7,4
Heart of Darkness,"Dark allegory describes the narrator's journey up the Congo River and his meeting with, and fascination by, Mr. Kurtz, a mysterious personage who dominates the unruly inhabitants of the region. Masterly blend of adventure, character development, psychological penetration. Considered by many Conrad's finest, most enigmatic story.",Joseph Conrad,http://books.google.com/books/content?id=2c_lltYHOywC&printsec=frontcover&img=1&zoom=1&edge=curl&source=gbs_api,http://books.google.com/books?id=2c_lltYHOywC&printsec=frontcover&dq=Heart+of+Darkness&hl=&cd=1&source=gbs_api,Courier Corporation,1990,http://books.google.com/books?id=2c_lltYHOywC&dq=Heart+of+Darkness&hl=&source=gbs_api,Fiction,18,12.99,25,4.32
Outsiders,The struggle of three brothers to stay together after their parent's death and their quest for identity among the conflicting values of their adolescent society.,S. E. Hinton,http://books.google.com/books/content?id=ceksEAAAQBAJ&printsec=frontcover&img=1&zoom=1&edge=curl&source=gbs_api,http://books.google.com/books?id=ceksEAAAQBAJ&printsec=frontcover&dq=Outsiders&hl=&cd=1&source=gbs_api,Pearson UK,2019,http://books.google.com/books?id=ceksEAAAQBAJ&dq=Outsiders&hl=&source=gbs_api,Bullying,286,20.99,25,3.44
"How to Win Friends & Influence People (Cardinal Editions, C 303)","Do you feel stuck in life, not knowing how to make it more successful? Do you wish to become more popular? Are you craving to earn more? Do you wish to expand your horizon, earn new clients and win people over with your ideas? How to Win Friends and Influence People is a well-researched and comprehensive guide that will help you through these everyday problems and make success look easier. You can learn to expand your social circle, polish your skill set, find ways to put forward your thoughts more clearly, and build mental strength to counter all hurdles that you may come across on the path to success. Having helped millions of readers from the world over achieve their goals, the clearly listed techniques and principles will be the answers to all your questions.",Dale Carnegie,http://books.google.com/books/content?id=hCf-DwAAQBAJ&printsec=frontcover&img=1&zoom=1&edge=curl&source=gbs_api,http://books.google.com/books?id=hCf-DwAAQBAJ&printsec=frontcover&dq=How+to+Win+Friends&hl=&cd=1&source=gbs_api,Sristhi Publishers & Distributors,2020/10/12,https://play.google.com/store/books/details?id=hCf-DwAAQBAJ&source=gbs_api,Self-Help,0,16.99,25,3.44
Plainsong,"National Book Award Finalist A heartstrong story of family and romance, tribulation and tenacity, set on the High Plains east of Denver. In the small town of Holt, Colorado, a high school teacher is confronted with raising his two boys alone after their mother retreats first to the bedroom, then altogether. A teenage girl‚Äîher father long since disappeared, her mother unwilling to have her in the house‚Äîis pregnant, alone herself, with nowhere to go. And out in the country, two brothers, elderly bachelors, work the family homestead, the only world they've ever known. From these unsettled lives emerges a vision of life, and of the town and landscape that bind them together‚Äîtheir fates somehow overcoming the powerful circumstances of place and station, their confusion, curiosity, dignity and humor intact and resonant. As the milieu widens to embrace fully four generations, Kent Haruf displays an emotional and aesthetic authority to rival the past masters of a classic American tradition.",Kent Haruf,http://books.google.com/books/content?id=YRxPSGS5eq0C&printsec=frontcover&img=1&zoom=1&edge=curl&source=gbs_api,http://books.google.com/books?id=YRxPSGS5eq0C&printsec=frontcover&dq=Plainsong&hl=&cd=1&source=gbs_api,Vintage,2001/4/3,https://play.google.com/store/books/details?id=YRxPSGS5eq0C&source=gbs_api,Fiction,117,10.14,13,3.31
The Secret Garden,"""One of th' gardens is locked up. No one has been in it for ten years."" When orphaned Mary Lennox comes to live at her uncle's great house on the Yorkshire Moors, she finds it full of mysterious secrets. There are nearly one hundred rooms, most of which are locked, and the house is filled with creepy old portraits and suits of armor. Mary rarely sees her uncle, and perhaps most unsettling of all is that at night she hears the sound of someone crying down one of the long corridors. The gardens surrounding the odd property are Mary's escape and she explores every inch of them‚Äîall except for the mysterious walled-in, locked garden. Then one day, Mary discovers a key. Could it open the door to the garden?",Frances Hodgson Burnett,http://books.google.com/books/content?id=9-1NYzVI55sC&printsec=frontcover&img=1&zoom=1&edge=curl&source=gbs_api,http://books.google.com/books?id=9-1NYzVI55sC&printsec=frontcover&dq=The+Secret+Garden&hl=&cd=1&source=gbs_api,Harper Collins,1998/3/6,http://books.google.com/books?id=9-1NYzVI55sC&dq=The+Secret+Garden&hl=&source=gbs_api,Juvenile Fiction,5,18.03,25,4.32
Crime and Punishment,"In a timeless story of justice, morality, and redemption, an impoverished Russian student murders a miserly landlady, a crime that has severe repercussions on his life and his family as he battles his conscience.",Fyodor Dostoyevsky,http://books.google.com/books/content?id=nVGKDgAAQBAJ&printsec=frontcover&img=1&zoom=1&edge=curl&source=gbs_api,http://books.google.com/books?id=nVGKDgAAQBAJ&printsec=frontcover&dq=Crime+and+Punishment&hl=&cd=1&source=gbs_api,Courier Corporation,2001,http://books.google.com/books?id=nVGKDgAAQBAJ&dq=Crime+and+Punishment&hl=&source=gbs_api,Fiction,2,21.19,6,3.67
Great Gatsby (Everyman),"Fitzgerald's masterpiece--the quintessential Jazz Age novel--now in a hardcover Everyman's Library Contemporary Classics edition For generations of enthralled readers, F. Scott Fitzgerald's mysterious millionaire, Jay Gatsby, has come to embody all the glamour and decadence of the Roaring Twenties. Gatsby emerges as if from nowhere, evading questions about his past and throwing dazzling parties sparkling with champagne and jazz at his luxurious Long Island mansion. Nick Carraway, a young man who has moved in next door, is fascinated by his oddly detached neighbor, and by his discovery that Gatsby is motivated by a single-minded quest to regain his long-lost love, Daisy Buchanan. Nick finds something both appalling and appealing about the intensity of Gatsby's ambition to reinvent himself. But Daisy and her wealthy husband are cynical and careless people, and as Gatsby's dream collides with reality, Nick is witness to the violence and tragedy that result. The Great Gatsby's remarkable staying power, nearly a century after its publication, is owed both to the lyrical freshness of its storytelling and to the way that it illuminates the hollow core of the glittering American dream. Everyman's Library pursues the highest production standards, printing on acid-free cream-colored paper, with full-cloth cases with two-color foil stamping, decorative endpapers, silk ribbon markers, European-style half-round spines, and a full-color illustrated jacket.",F. Scott Fitzgerald,http://books.google.com/books/content?id=Ax4tEAAAQBAJ&printsec=frontcover&img=1&zoom=1&edge=curl&source=gbs_api,http://books.google.com/books?id=Ax4tEAAAQBAJ&printsec=frontcover&dq=Great+Gatsby+(Everyman)&hl=&cd=1&source=gbs_api,Everyman's Library,2021,http://books.google.com/books?id=Ax4tEAAAQBAJ&dq=Great+Gatsby+(Everyman)&hl=&source=gbs_api,American Dream,0,12.99,16,2.56
"Crossroads of Twilight (The Wheel of Time, Book 10)","The Wheel of Time ¬Æ is a PBS Great American Read Selection! Now in development for TV! Since its debut in 1990, The Wheel of Time¬Æ by Robert Jordan has captivated millions of readers around the globe with its scope, originality, and compelling characters. The Wheel of Time turns and Ages come and go, leaving memories that become legend. Legend fades to myth, and even myth is long forgotten when the Age that gave it birth returns again. In the Third Age, an Age of Prophecy, the World and Time themselves hang in the balance. What was, what will be, and what is, may yet fall under the Shadow. Fleeing from Ebou Dar with the kidnapped Daughter of the Nine Moons, whom he is fated to marry, Mat Cauthon learns that he can neither keep her nor let her go, not in safety for either of them, for both the Shadow and the might of the Seanchan Empire are in deadly pursuit. Perrin Aybara seeks to free his wife, Faile, a captive of the Shaido, but his only hope may be an alliance with the enemy. Can he remain true to his friend Rand and to himself? For his love of Faile, Perrin is willing to sell his soul. At Tar Valon, Egwene al'Vere, the young Amyrlin of the rebel Aes Sedai, lays siege to the heart of Aes Sedai power, but she must win quickly, with as little bloodshed as possible, for unless the Aes Sedai are reunited, only the male Asha'man will remain to defend the world against the Dark One, and nothing can hold the Asha'man themselves back from total power except the Aes Sedai and a unified White Tower. In Andor, Elayne Trakland fights for the Lion Throne that is hers by right, but enemies and Darkfriends surround her, plotting her destruction. If she fails, Andor may fall to the Shadow, and the Dragon Reborn with it. Rand al'Thor, the Dragon Reborn himself, has cleansed the Dark One's taint from the male half of the True Source, and everything has changed. Yet nothing has, for only men who can channel believe that saidin is clean again, and a man who can channel is still hated and feared-even one prophesied to save the world. Now, Rand must gamble again, with himself at stake, and he cannot be sure which of his allies are really enemies. TV series update: ""Sony will produce along with Red Eagle Entertainment and Radar Pictures. Rafe Judkins is attached to write and executive produce. Judkins previously worked on shows such as ABC‚Äôs ‚ÄúAgents of SHIELD,‚Ä?the Netflix series ‚ÄúHemlock Grove,‚Ä?and the NBC series ‚ÄúChuck.‚Ä?Red Eagle partners Rick Selvage and Larry Mondragon will executive produce along with Radar‚Äôs Ted Field and Mike Weber. Darren Lemke will also executive produce, with Jordan‚Äôs widow Harriet McDougal serving as consulting producer."" ‚ÄîVariety The Wheel of Time¬Æ New Spring: The Novel #1 The Eye of the World #2 The Great Hunt #3 The Dragon Reborn #4 The Shadow Rising #5 The Fires of Heaven #6 Lord of Chaos #7 A Crown of Swords #8 The Path of Daggers #9 Winter's Heart #10 Crossroads of Twilight #11 Knife of Dreams By Robert Jordan and Brandon Sanderson #12 The Gathering Storm #13 Towers of Midnight #14 A Memory of Light By Robert Jordan Warrior of the Altaii By Robert Jordan and Teresa Patterson The World of Robert Jordan's The Wheel of Time By Robert Jordan, Harriet McDougal, Alan Romanczuk, and Maria Simons The Wheel of Time Companion By Robert Jordan and Amy Romanczuk Patterns of the Wheel: Coloring Art Based on Robert Jordan's The Wheel of Time At the Publisher's request, this title is being sold without Digital Rights Management Software (DRM) applied.",Robert Jordan,http://books.google.com/books/content?id=ER6BqLHOmO4C&printsec=frontcover&img=1&zoom=1&edge=curl&source=gbs_api,"http://books.google.com/books?id=ER6BqLHOmO4C&printsec=frontcover&dq=Crossroads+of+Twilight+(The+Wheel+of+Time,+Book+10)&hl=&cd=1&source=gbs_api",Tor Fantasy,2010/7/20,https://play.google.com/store/books/details?id=ER6BqLHOmO4C&source=gbs_api,Fiction,65,25.01,25,1.28
The Happiest Baby on the Block: The New Way to Calm Crying and Help Your Newborn Baby Sleep Longer,"""Thousands of parents, from regular moms and dads to Hollywood superstars, have come to baby expert Dr. Harvey Karp to learn his remarkable techniques for soothing babies and increasing sleep. Now his landmark book--fully revised and updated with the latest insights into infant sleep, bedsharing, breastfeeding, swaddling, and SIDS risk--can teach you too!""--Back cover.",Harvey Karp,http://books.google.com/books/content?id=RSDZCwAAQBAJ&printsec=frontcover&img=1&zoom=1&edge=curl&source=gbs_api,http://books.google.com/books?id=RSDZCwAAQBAJ&printsec=frontcover&dq=The+Happiest+Baby+on+the+Block:+The+New+Way+to+Calm+Crying+and+Help+Your+Newborn+Baby+Sleep+Longer&hl=&cd=1&source=gbs_api,Bantam,2015,http://books.google.com/books?id=RSDZCwAAQBAJ&dq=The+Happiest+Baby+on+the+Block:+The+New+Way+to+Calm+Crying+and+Help+Your+Newborn+Baby+Sleep+Longer&hl=&source=gbs_api,FAMILY & RELATIONSHIPS,61,28.99,25,2.8
Goodnight Moon,"In this classic of children's literature, beloved by generations of readers and listeners, the quiet poetry of the words and the gentle, lulling illustrations combine to make a perfect book for the end of the day. In a great green room, tucked away in bed, is a little bunny. ""Goodnight room, goodnight moon."" And to all the familiar things in the softly lit room‚Äîto the picture of the three little bears sitting on chairs, to the clocks and his socks, to the mittens and the kittens, to everything one by one‚Äîthe little bunny says goodnight. One of the most beloved books of all time, Goodnight Moon is a must for every bookshelf and a time-honored gift for baby showers and other special events.",Margaret Wise Brown,http://books.google.com/books/content?id=dJNoDQAAQBAJ&printsec=frontcover&img=1&zoom=1&edge=curl&source=gbs_api,http://books.google.com/books?id=dJNoDQAAQBAJ&printsec=frontcover&dq=Goodnight+Moon&hl=&cd=1&source=gbs_api,HarperCollins,2016/11/8,https://play.google.com/store/books/details?id=dJNoDQAAQBAJ&source=gbs_api,Juvenile Fiction,193,13.52,25,2.88
"No man knows my history: The life of Joseph Smith, the Mormon prophet","The first paperback edition of the classic biography of the founder of the Mormon church, this book attempts to answer the questions that continue to surround Joseph Smith. Was he a genuine prophet, or a gifted fabulist who became enthralled by the products of his imagination and ended up being martyred for them? 24 pages of photos. Map.",Fawn McKay Brodie,http://books.google.com/books/content?id=nbBMEAAAQBAJ&printsec=frontcover&img=1&zoom=1&edge=curl&source=gbs_api,"http://books.google.com/books?id=nbBMEAAAQBAJ&printsec=frontcover&dq=No+man+knows+my+history:+The+life+of+Joseph+Smith,+the+Mormon+prophet&hl=&cd=1&source=gbs_api",Vintage,1995,"http://books.google.com/books?id=nbBMEAAAQBAJ&dq=No+man+knows+my+history:+The+life+of+Joseph+Smith,+the+Mormon+prophet&hl=&source=gbs_api",Biography & Autobiography,15,14.32,9,4.11
The Fellowship of the Rings,No description available,Unknown author,,,Unknown publisher,Unknown date,,Uncategorized,0,21.72,0,0
The Lord of the Rings - Boxed Set,"This beautiful gift edition of The Hobbit, J.R.R. Tolkien's classic prelude to his Lord of the Rings trilogy, features cover art, illustrations, and watercolor paintings by the artist Alan Lee. Bilbo Baggins is a hobbit who enjoys a comfortable, unambitious life, rarely traveling any farther than his pantry or cellar. But his contentment is disturbed when the wizard Gandalf and a company of dwarves arrive on his doorstep one day to whisk him away on an adventure. They have launched a plot to raid the treasure hoard guarded by Smaug the Magnificent, a large and very dangerous dragon. Bilbo reluctantly joins their quest, unaware that on his journey to the Lonely Mountain he will encounter both a magic ring and a frightening creature known as Gollum. Written for J.R.R. Tolkien's own children, The Hobbit has sold many millions of copies worldwide and established itself as a modern classic.",J.R.R. Tolkien,http://books.google.com/books/content?id=CixXEAAAQBAJ&printsec=frontcover&img=1&zoom=1&source=gbs_api,http://books.google.com/books?id=CixXEAAAQBAJ&dq=The+Lord+of+the+Rings+-+Boxed+Set&hl=&cd=1&source=gbs_api,HarperCollins,2012/11/8,http://books.google.com/books?id=CixXEAAAQBAJ&dq=The+Lord+of+the+Rings+-+Boxed+Set&hl=&source=gbs_api,Young Adult Fiction,38,10.99,25,3.76
Leaves of grass,"Leaves of Grass is a poetry collection by the American poet Walt Whitman (1819‚Ä?892). Though the first edition was published in 1855, Whitman spent his entire life writing and re-writing Leaves of Grass, revising it in several editions until his death. This resulted in vastly different editions over four decades‚Äîthe first a small book of twelve poems and the last a compilation of over 400 poems.The poems of Leaves of Grass are loosely connected and each represents Whitman's celebration of his philosophy of life and humanity. This book is notable for its discussion of delight in sensual pleasures during a time when such candid displays were considered immoral. Where much previous poetry, especially English, relied on symbolism, allegory, and meditation on the religious and spiritual, Leaves of Grass (particularly the first edition) exalted the body and the material world. Influenced by Ralph Waldo Emerson and the Transcendentalist movement, itself an offshoot of Romanticism, Whitman's poetry praises nature and the individual human's role in it. However, much like Emerson, Whitman does not diminish the role of the mind or the spirit; rather, he elevates the human form and the human mind, deeming both worthy of poetic praise.",Walt Whitman,http://books.google.com/books/content?id=_27qoQEACAAJ&printsec=frontcover&img=1&zoom=1&source=gbs_api,http://books.google.com/books?id=_27qoQEACAAJ&dq=Leaves+of+grass&hl=&cd=1&source=gbs_api,Createspace Independent Pub,2014/9/9,http://books.google.com/books?id=_27qoQEACAAJ&dq=Leaves+of+grass&hl=&source=gbs_api,Poetry,5,17.99,2,5
To Kill A Mockingbird,"Voted America's Best-Loved Novel in PBS's The Great American Read Harper Lee's Pulitzer Prize-winning masterwork of honor and injustice in the deep South‚Äîand the heroism of one man in the face of blind and violent hatred One of the most cherished stories of all time, To Kill a Mockingbird has been translated into more than forty languages, sold more than forty million copies worldwide, served as the basis for an enormously popular motion picture, and was voted one of the best novels of the twentieth century by librarians across the country. A gripping, heart-wrenching, and wholly remarkable tale of coming-of-age in a South poisoned by virulent prejudice, it views a world of great beauty and savage inequities through the eyes of a young girl, as her father‚Äîa crusading local lawyer‚Äîrisks everything to defend a black man unjustly accused of a terrible crime.",Harper Lee,http://books.google.com/books/content?id=PGR2AwAAQBAJ&printsec=frontcover&img=1&zoom=1&edge=curl&source=gbs_api,http://books.google.com/books?id=PGR2AwAAQBAJ&printsec=frontcover&dq=To+Kill+A+Mockingbird&hl=&cd=1&source=gbs_api,Harper Collins,2014/7/8,https://play.google.com/store/books/details?id=PGR2AwAAQBAJ&source=gbs_api,Fiction,2164,10.99,25,3.92
Foundation and Empire,"This book presents the ontological and logical foundation of a new form of thinking, the beginning of an ¬ìabsolute phenomenology.¬î It does so in the context of the history of thought in Europe and America. It explores the ramifications of a categorically new logic. Thinkers dealt with include Plato, Galileo, Hegel, Kierkegaard, Marx, Nietzsche, Husserl, Heidegger, Peirce, James, Dewey, Derrida, McDermott, and Altizer.",D. G. Leahy,http://books.google.com/books/content?id=rDzOFxs4ZlYC&printsec=frontcover&img=1&zoom=1&edge=curl&source=gbs_api,http://books.google.com/books?id=rDzOFxs4ZlYC&printsec=frontcover&dq=Foundation+and+Empire&hl=&cd=1&source=gbs_api,SUNY Press,1996/1/1,http://books.google.com/books?id=rDzOFxs4ZlYC&dq=Foundation+and+Empire&hl=&source=gbs_api,Religion,0,16.99,4,3.75
Red Tent,"In a story based on the Book of Genesis, Jacob's only daughter, Dinah, shares her unique perspective on the origins of many of our modern religious practices and sexual politics, eager to impart the lessons in endurance and humanity she has learned from her father's wives. 45,000 first printing.",Anita Diamant,http://books.google.com/books/content?id=ud-9Rj9ubPsC&printsec=frontcover&img=1&zoom=1&edge=curl&source=gbs_api,http://books.google.com/books?id=ud-9Rj9ubPsC&printsec=frontcover&dq=Red+Tent&hl=&cd=1&source=gbs_api,Macmillan,1997/9/15,http://books.google.com/books?id=ud-9Rj9ubPsC&dq=Red+Tent&hl=&source=gbs_api,Fiction,3656,12.58,25,2.84
Alice's Adventures in Wonderland and Through the Looking Glass,"All the ""muchness"" of Wonderland captured in one book! Follow Alice down the rabbit hole to Wonderland and enjoy tea with the Mad Hatter, find your way with the Cheshire Cat, and play croquet with the Queen of Hearts. On the other side of the looking-glass, meet Tweedledee and Tweedledum, the White Queen, and a host of other characters that share a different reality.",Lewis Carroll,http://books.google.com/books/content?id=didZDwAAQBAJ&printsec=frontcover&img=1&zoom=1&edge=curl&source=gbs_api,http://books.google.com/books?id=didZDwAAQBAJ&printsec=frontcover&dq=Alice%27s+Adventures+in+Wonderland+and+Through+the+Looking+Glass&hl=&cd=1&source=gbs_api,Simon and Schuster,2016/4/1,https://play.google.com/store/books/details?id=didZDwAAQBAJ&source=gbs_api,Fiction,10,20.25,0,0
The Great Divorce,"What if anyone in Hell could take a bus trip to Heaven and stay there forever if they wanted to? In The Great Divorce C. S. Lewis again employs his formidable talent for fable and allegory. The writer finds himself in Hell boarding a bus bound for Heaven. The amazing opportunity is that anyone who wants to stay in Heaven, can. This is the starting point for an extraordinary meditation upon good and evil, grace and judgment. Lewis's revolutionary idea is the discovery that the gates of Hell are locked from the inside. In Lewis's own words, ""If we insist on keeping Hell (or even earth) we shall not see Heaven: if we accept Heaven we shall not be able to retain even the smallest and most intimate souvenirs of Hell.""",C. S. Lewis,http://books.google.com/books/content?id=2EDARL4gw20C&printsec=frontcover&img=1&zoom=1&edge=curl&source=gbs_api,http://books.google.com/books?id=2EDARL4gw20C&printsec=frontcover&dq=The+Great+Divorce&hl=&cd=1&source=gbs_api,Harper Collins,2009/3/3,http://books.google.com/books?id=2EDARL4gw20C&dq=The+Great+Divorce&hl=&source=gbs_api,Religion,21,24.99,9,3.89
